,Unnamed: 0,sentence
8697,8697,"""Dziś wiele mówi się o technikach modlitwy, wśród nich wymienia się hezychazm lub modlitwę serca. Istnieje wiele sposobów całowania kogoś, ale najlepszy polega bez wątpienia na pominięciu wszelkich technik i na prawdziwej miłości. To właśnie dlatego, że brak nam wiary i miłości, odczuwamy potrzebę metod w naszych relacjach z Bogiem"". Obowiązują wizy, odprawa paszportowa, a przy wyjeździe celnik gruntownie przeszukuje rzeczy w poszukiwaniu skarbów, których tak wiele stąd ukradziono. Współcześnie żyje tu 1700 mnichów i tyluż pracowników świeckich, zatrudnianych przy rolnictwie, choć krajobraz zdominowany jest przez lasy, skały i wznoszący się samotny szczyt świętej góry), budowie dróg (pierwszą przejezdną drogę wybudowano tutaj dopiero w latach sześćdziesiątych), wyrębie lasów i obsłudze pielgrzymów. Urodzony w r. 1858, w arystokratycznej, zamożnej rodzinie, osierocony we wczesnym dzieciństwie, w wieku 15 lat traci wiarę. Zostaje oficerem, prowadzi rozwiązłe i hulaszcze życie, trwoni odziedziczoną po dziadku fortunę. Odczuwa jednak dotkliwie pustkę, brak sensu życia. Gdy odbywa służbę wojskową w Maroku, wielkie wrażenie robi na nim głęboka religijność wyznawców Islamu. Ksiądz ze swoim pomocnikiem odeszli, a żebraczka stała samotnie u wezgłowia grobu. Zrobiło się fioletowo i po chwili rozległ się grzmot podobny do wybuchu wojny na wojennym filmie. I gdzieś, może z tego samego drzewa, oderwała się jeszcze jedna gałąź. Dziadek szybko przeżegnał się. Byłam młoda i wesoła, no to pomyślałam sobie - mój Boże, może coś potrafię dać. Uznałam to za odpowiedź na moją modlitwę. Laski od razu mnie zauroczyły. Pracowałam przecież z ich twórcami: jakiś czas pod kierunkiem Matki Czackiej, głównie jednak z panem Antonim Marylskim, a spotykałam też naturalnie księdza Korniłowicza. Okazało się, iż żywa jest w nich pamięć o pewnym polskim pisarzu, stypendyście sprzed lat, który w przystępie ataku silnej adoracji dla płynnych żywiołów postanowił skoczyć z pokładu w nurty Missisipi. Może nawet ten skok był trochę symboliczny, antycypował bowiem rychły i dramatyczny skok owego Rodaka w Amerykę. Okazałem się kiepskim kontynuatorem tej tradycji. Obchody zakończenia Roku Maryjnego rozpoczęły się 14 bm. wieczorem w rzymskiej bazylice Santa Maria Maggiore nabożeństwem w obrządku koptyjskim, w którym wziął udział Ojciec św. Liturgii przewodniczył patriarcha aleksandryjski dla Koptów wraz z biskupami i kapłanami tego obrządku. Homilię wygłosił Jan Paweł II. Ojciec św. zachęcił wspólnotę katolickiego Kościoła koptyjskiego do wierności swej tradycji, pozdrowił jednocześnie prawosławnych i Koptów. Pod koniec tej dekady zaczyna krążyć wieść, że autorem tekstu jest Krzysztof Dowgiałło, architekt gdański, senator ""Solidarności"" w latach 1989-1991. Jednak podczas telewizyjnego programu wyborczego przed wyborami 4 czerwca 1989 roku, zapytany przez prowadzącego, czy napisał ""Balladę o Janku Wiśniewskim"", Dowgiałło odpowiada enigmatycznie: ""Co miało być anonimowe, niech będzie anonimowe"". Obecnie potwierdza już fakt swojego autorstwa zupełnie otwarcie. Równe 200 tysięcy. Gdyby nie drobna nieostrożność, wszyscy byliby uszczęśliwieni. Towarzystwo pozyskałoby kolejnego zaufanego swojego człowieka, a człowiek - społeczne poważanie. Niestety, jak  Gogolowskiego  Chlestakowa, zgubiła go miłość do literatury. Pamiętnik, w którym skreślił smakowite portrety wszystkich mu życzliwych, trafił niespodzianie w ręce sportretowanych. Pojęcie ""reprywatyzacji"" obejmuje bardzo różne przypadki i rozmaite procedury. Być może to jest jednym z powodów, dla których tak trudne okazało się przyjęcie wspólnej dla nich wszystkich ustawowej wykładni. Tym bardziej, że bez liku było i jest nadal przepisów, na podstawie których mienia niegdyś pozbawiano. ""Throw out"" znaczy  ""wyrzucić"" . Rzecz jasna krzywdzące Amerykanów i głupie byłoby traktowanie tego wielkiego narodu, który wydał i wydaje wielkich pisarzy, poetów i filozofów, jako dzikie plemię i barbarię. Rzecz w tym tylko, że np. obecnie w Polsce łatwiej przyjmujemy z Ameryki, niewątpliwego centrum naszej cywilizacji, cechy zmienne i powierzchowne. ""Wartość modlitwy nie zależy od nas. Jest to dzieło Boga. Od nas natomiast zależy jej częstotliwość. Możemy powtarzać Imię Jezusa niestrudzenie. Jak owa kobieta z Ewangelii trzeba nieustannie wołać: 'Ulituj się nade mną' (Mt 15,22), a Bóg zmiłuje się nad nami"". Duchowość Athosu kojarzy się w pierwszej kolejności z modlitwą hezychastyczną. Wywodzi się ona od opata klasztoru na Synaju, Jana Klimaka, który zalecał częste wzywanie ""imienia Jezus"". Czego zresztą udało się dokonać podczas rewolucji 1917 roku... Traktujmy te  Sołżenicynowskie  słowa jako naukę dla znakomitej części parlamentarzystów rosyjskich, którzy o Stołypinie wiedzą tylko tyle, iż był on ""reakcyjnym kontrrewolucjonistą""... Jednakże Sołżenicyn, wspomniawszy o ""surowym doświadczeniu"" rosyjskiego przedrewolucyjnego parlamentaryzmu, zwrócił się do deputowanych jako ""przedstawicieli piątej Dumy"", którzy oby kontynuowali tylko te dobre państwowotwórcze tradycje demokratyczne. Czy zdążymy przed deszczem pochować pana Sierożę?"
8698,8698,"Pomiędzy klonami, które swoimi ciężkimi konarami zatrzymują słoneczne promienie i pogrążają cmentarz w mroku, kłębią się granatowe chmury poprzetykane miejscami różowymi pasemkami. Wszyscy z niepokojem spoglądamy w górę i potykamy się na nierównej cmentarnej alei. W gałęziach nawołują niespokojnie ptaki, a nad ich szczebiotem i kwileniem góruje twarde krakanie wron, które roznosi się echem po całym cmentarzu. Głównym zadaniem Uniwersytetu Nanzan jest więc nie tyle doprowadzenie do maksymalnej liczby chrztów nawróconych Japończyków, ile ""chrzest"" całej kultury japońskiej, przepojenie tego społeczeństwa wartościami chrześcijańskimi. Praca pedagogiczna na uniwersytecie japońskim różni się znacznie od pracy na uniwersytecie europejskim. Tutaj profesorowie mają wiele zajęć tzw. pozalekcyjnych. Film, jakkolwiek ściąga młodzież do kin i wypożyczalni kaset, odbierany jest głównie na poziomie opowiadanej przezeń historii. Proszę spróbować dotrzeć z młodzieżą w  pofilmowej  refleksji do ukrytych, symbolicznych sensów takiego choćby Jurassic Park, nie mówiąc już Tajemniczym ogrodzie. Brak nawyku refleksji przy zetknięciu z dziełem sztuki towarzyszy u młodych zubożeniu, czy wręcz spaczeniu wyobraźni. Wystarczy poczytać swobodne, twórcze wypracowania uczniów szkół podstawowych. Skróty, jak w filmie puszczonym bardzo szybko: od chwili śpiewu do śmiertelnej agonii. I należy przyznać, że kaligraficzność ma swoje wady, bo dążąc do uchwycenia sytuacji jednym ruchem pióra czy pędzelka umoczonego w tuszu, poeta ryzykuje, że przedobrzy i wtedy czystość linii psuje kleks czy, tłumacząc to na dźwięk, następuje kleks, jak zgrzyt po szkle. Do sklepów i do domów, dzięki telewizji, wjeżdża więc Santa Claus, będący bardziej poczciwym, jowialnym, rozbawionym Dziadkiem Mrozem niż statecznym biskupem z Myry, dyskretnym Świętym Mikołajem. Santa podróżuje w saniach zaprzężonych w 4 pary reniferów i ""kiedy śmieje się, jego okrągły brzuszek trzęsie się jak miska galaretki"". Przynosi on podarunki w nocy z 24 na 25, przedostając się do domów poprzez komin. Tymczasem w liceach prowadzonych przez Społeczne Towarzystwo Oświatowe zdanie egzaminu dojrzałości nie należy do najłatwiejszych. W 1993 roku w liceach państwowych nie zdało matury tylko 4% uczniów, w szkołach niepublicznych ponad 12% abiturientów. Rok później matury nie zdało ponad 8%, ale były szkoły, gdzie tylko 60% otrzymało świadectwa maturalne: w jednej z warszawskich szkół z 40 zdających oblano 10 osób. Ktoś tak przenikliwy miałby zaufać komuś, kto rozpoczął swój marsz ku wiecznej szczęśliwości pod hasłem ""grab zagrabione""?"
8705,8705,"Tak samo w r. 1863 nie potrafiono rozwiązać problemu agrarnego - zrobili to za nas Rosjanie. Jako swą dewizę Nanzan przyjął hasło: ""Hominis dignitati"" - ""w trosce o godność człowieka"", godność, wynikającą z chrześcijańskiej antropologii. Nie znaczy to wcale, że na wykładach z ekonomii czy prawa, głoszone są ""umoralniające kazania"". Uczelnia ta, jak każda inna, musi przede wszystkim przygotować studentów do przyszłej pracy zawodowej i do pełnienia odpowiedzialnych funkcji w społeczeństwie i państwie. W rezultacie jej działalność ""na sobie"" odbierają obojętnie lub wrogo. Dziś, w epoce szybkiego różnicowania się naszej rzeczywistości, szkolnictwo, szczególnie podstawowe, pozostaje reliktem unifikacji. Na jednakowych osiedlach, w jednakowych budynkach jednakowo toczy się szkolne życie. Pozbawione osobowości szkoły wypuszczają takich właśnie wychowanków. Szansą zmiany na lepsze może być, choćby nieśmiała, próba zanegowania tego stanu rzeczy. Nie tak dawno do tradycyjnego repertuaru świątecznego dołączona została opera Gian-Carlo Menottiego ""Amahl i nocni przybysze"" (1951), inspirowana ""Adoracją Trzech Króli"" Hieronima Boscha. W programie telewizyjnym wielokrotnie, w różnych dniach, godzinach i programach pojawia się w grudniu stary klasyk Franka Capry ze świątecznym happy-endem, zatytułowany ""Jakie cudowne jest życie"". Słowo asceza oznacza między innymi ograniczenie, wyrzeczenie. Większość zakazów, które przyjmuje na siebie wstępujący do monasteru mnich, ma dopomóc mu w oddzieleniu tego, co ważne, tego, co nie jest ważne na jego drodze. Zakaz dotyczący pobytu kobiet na Athosie może dla ""łacinnika"" wydawać się reliktem. Ożywa jednak w opowieściach mnichów, które na naszych oczach stają się legendą. Weźmy, Restauracja we Francji; po upadku Napoleona społeczeństwo odrzuciło  Burbonów . Nasz konflikt między Komitetem Narodowym w Paryżu a krajem. Po II wojnie emigracja londyńska była patriotyczna w masach żołnierskich, ale bez wpływu. Rządziła elita, od tych mas podobnie oderwana w myśleniu, co od kraju. FRANCUZI: Są dla nas istotni w jednym: w razie naszego konfliktu z Niemcami, możemy liczyć na ich przychylność. Jurek sczerwieniał z zażenowania - ""Po co mówisz takie rzeczy?"
8710,8710,"O zarzutach i wątpliwościach podnoszonych w trakcie opracowywania i uchwalania stosownej ustawy była już mowa. Niedawno premier Pawlak sformułował publicznie, w specjalnym wystąpieniu telewizyjnym, swoje własne zastrzeżenia. Obawia się on mianowicie powierzania kontroli nad narodowymi funduszami inwestycyjnymi firmom, które nie będą w nie zaangażowane kapitałowo, a więc nie będą odpowiadać za swoje decyzje własnym majątkiem. Jego postawa ma znaczenie tylko i wyłącznie dla poczucia honoru Polaków. Wydawałoby się, że ma też wpływ na to, ile GM zainwestuje w Polsce czy stworzy miejsca pracy. Ale tylko do pewnego stopnia. Oczywiście, koncernowi zależy na nowych rynkach, nie może lekceważyć okazyjnych, bo tańszych, miejsc produkcji. Ale nie robimy mu łaski. Wielki przyjaciel polskiej kultury urodzony w święciańskim powiecie, historyk literatury - Adam Maldas, fotografik Adamowicz... Po moskiewskich i orłowskich doświadczeniach poczułem się jak u siebie w domu. Moi gospodarze z naturalnością przechodzili z języka białoruskiego na polski i na odwrót. Czuło się tę wielowiekową bliskość pokrewnych narodów. Białorusini nie byliby sobą, gdyby nie Rzeczpospolita Wielu Narodów. Zarazem jest ono poddane naszym skłonnościom emocjonalnym. Pesymizm i optymizm ujawniają się, zwłaszcza gdy myślimy o przyszłości. Te skłonności  temperamentalne  bywają także funkcją naszej sytuacji - co słusznie podkreśla Francis Fukuyama. Do pesymizmu ma dziś skłonność lewica, która chce widzieć sukces świata liberalno-kapitalistycznego jako dziejowy epizod. Inny problem to coraz częstsza nieumiejętność oderwania się od pracy choćby nawet na krótko, która u patologicznie uzależnionych od aktywności zawodowej jednostek (workoholics) doprowadza do przykrych psychosomatycznych symptomów jak przy gwałtownym pozbawieniu dostępu do tytoniu, alkoholu czy narkotyków. Coraz częściej ludzi trapi poczucie małej wartości, obawa, że nie uda się im zrobić odpowiedniego wrażenia na rzadko widywanych bliskich. Dzieło Anny Świrszczyńskiej wymaga szczególnego rodzaju uwagi, nie takiego, do jakiego przyzwyczaiły nas badania literackie, niechętne tropieniu biografii autorów, jak to robiono w wieku dziewiętnastym. Rzecz polega na tym, że jej dzieło poetyckie ofiarowuje się jako spełniony los, ale spełniony nie poprzez artyzm, z życiorysem gdzieś w tle, ale jako jedność wierszy i osoby, gwałtownej, namiętnej, dumnej, pokornej, grzesznej, współczującej, miłującej, szalonej. ""Niepubliczni"" dostają jednak tylko ok. 200 tysięcy na jednego ucznia. Po prostu nie ma pieniędzy. Kurator, do którego należy rozdział finansów, często musi wybierać między domem dziecka a szkołą niepubliczną. Nie dziwi więc, że woli wesprzeć dzieci, którym nikt inny nie pomoże. On tylko obwieszczał!"
8720,8720,"MIŁOSZ: Emigracja jest dla niego symbolem wstecznictwa. Ośmiesza ją, ale jako poeta wyrósł na emigracji. MIT: Z przyczyn dla mnie niejasnych istnieje mit Polski wśród narodów środkowo- i wschodnioeuropejskich. My byliśmy tylko wycinkiem Jego aktywności. Osoby naprawdę ważne to była Roma Szczepkowska, która wkładała ogromnie dużo energii w przygotowanie ""Mszy za Ojczyznę"", i Jacek Lipiński. Zajęcia ""uniwersytetu"" zaczynał swoim wykładem o nauce społecznej Kościoła - Michał Boni, wtedy młody, mądry polonista. Przekrój tematów był szeroki, od historii związków zawodowych do polityki międzynarodowej. Huntington nie przyjmuje zatem argumentu o globalnej sekularyzacji. Natomiast światowa komunikacja i interakcje gospodarcze bardziej wzmacniają poczucie odrębności i skłaniają do oporu wobec innych, niż sprzyjają kulturowemu ujednoliceniu. Są jeszcze dwie propozycje, na które Huntington dotąd nie odpowiedział. Jedna powiada (Hassner), że nie istnieje paradygmat czy model polityczny globalny. Świat jest chaotyczny, procesy rozwojowe nie układają się w logiczne ciągi i trzeba się z tym pogodzić. I jeszcze raz ten sam wiersz Kunitza: cóż z tego, że ""the rodent's tooth"" oznacza trywialny ""ząb gryzonia"", gdy nam pomyłkowe wzięcie słowa ""rodent"" za ""rotten"" pozwala wprowadzić o ileż boleśniejszy i dramatyczniejszy ""zropiały ząb""?"
8735,8735,"W Sądzie Rejonowym we Wrocławiu rozpoczął się wczoraj proces Jacka K. - prokuratora oskarżonego o to, że dwa lata temu ugryzł w palec Alinę F. oraz znieważył czterech policjantów. Prokuratorowi grozi do 5 lat więzienia. Jacek K. wycofał wyjaśnienia, jakie złożył w prokuraturze. Dwa lata temu tłumaczył: - Kobieta uderzyła mnie w twarz oraz złapała za dolną wargę."
8816,8816,"Członkowie delegacji z Biełgorodu, którzy od kilku dni zwiedzali Opolszczyznę, przywieźli dla nas dary: karetkę pogotowia i pieniądze dla Państwowego Domu Dziecka w Chmielowicach. Karetka, wartości 62 tys. zł, została przekazana Wojewódzkiej Kolumnie Transportu Sanitarnego w Opolu. A kluczyki do niej, m.in. w obecności wojewody Ryszarda Zembaczyńskiego, wręczył pierwszy zastępca premiera obwodu biełgorodzkiego Wiaczesław Iwanienko."
8821,8821,"W komisjach obwodowych może zasiadać od pięciu do dziewięciu osób; każdemu przysługuje dieta w wysokości 136 złotych. Członkowie komisji terytorialnych dostaną po 203 złote. A więc jest o co walczyć... Włodarze gmin zgłaszali do każdej komisji po jednym pracowniku samorządowym. Czym natomiast kierowały się komitety, które zgłaszały listy zainteresowanych pracą w komisjach?"
8882,8882,"Metody określania wielkości odpływu gruntowego w rzece są z konieczności uproszczone ze względu na kosztowność badań hydrogeologicznych. Do metod najczęściej wykorzystywanych należy wymieniona powyżej krzywa recesji odpływu, opisana równaniem wykładniczym (Mailleta i Dębskiego), metoda hydrologiczno-hydrogeologiczna uproszczona (Radczuk i Szarskiej, 1986) i metoda hydrogeologiczna uproszczona Bindemanna. Biorąc pod uwagę, że ewapotranspiracja roślinności jest na ogół głównym składnikiem parowania terenowego zlewni, strukturę modelu parowania terenowego oparto przede wszystkim na strukturze modelu ewapotranspiracji, uwzględniając w niej dodatkowo m.in. parametr określający powierzchnię obszaru quasi-jednorodnych pól. Powierzchnię czynną i podłoże tych pól scharakteryzowano za pomocą parametru szorstkości, albedo, zdolności emisyjnej powierzchni czynnej, polowej pojemności wodnej profilu glebowego, współczynnika trwałego więdnięcia itp. W przypadku, gdy dysponujemy wystarczającym rozpoznaniem hydrologicznym warstwy lub warstw wodonośnych hydraulicznie związanych z rzeką, znamy rytm wahań zwierciadła wód podziemnych różnych horyzontów i dokładny hydrogram odpływu, możemy przeprowadzić na podstawie jednego z czterech schematów rozdział hydrogramu wezbrania (Ground Water Studies, 1975). Dokładny opis schematów rozdziału hydrogramu przedstawiono na rysunku II.16. Metody badawcze w sieci małych zlewni najczęściej sprowadzają się do analizy regionalnej elementów hydrometeorologicznych i fizycznogeograficznych. Wykorzystują one informację o zasilaniu i odpływie z sieci zlewni do identyfikacji prostych modeli regresyjnych w zlewniach o niedostatecznej kontroli hydrometrycznej. Zagadnienie to omówiono wyczerpująco w rozdz. XIV. Czwarta faza występuje wówczas, gdy sieć cieków (naturalna lub sztuczna) jest wystarczająco gęsta, aby mogło nastąpić połączenie się łańcuchów plam z wodami drenażowymi. Jeżeli warunek ten nie jest spełniony, fala wód zretencjonowanych na powierzchni osiąga lokalną bazę drenażu zatrzymując się w najgłębszym zagłębieniu, kończąc tym samym proces transformacji na trzeciej fazie. Opad ciekły w okresie zimowym i wegetacyjnym na pokrywie roślin iglastych zatrzymuje się na ogół jednakowo. Inne jest tempo procesu intercepcji roślin, gdy występuje deszcz ze śniegiem, inne wreszcie, gdy pada wyłącznie śnieg. Płatki śniegu docierają bez przeszkód do podłoża, inne zatrzymują się na szpilkach drzew iglastych, suchych liściach, gałęziach Model SSARR (Streamflow Simulation and Reservoir Regulation), opracowany i wdrożony w końcu lat sześćdziesiątych w Stanach Zjednoczonych do prognozowania odpływu i sterowania systemu wodnego rzeki Columbia (Runoff evaluation..., 1971), stanowi jeden z prostszych modeli symulacyjnych zlewni. Algorytm modelu stanowią równania empiryczne, a parametry równania są identyfikowane w procesie optymalizacji. A zatem model ten może znaleźć zastosowanie wyłącznie w zlewniach o kontrolowanym odpływie. Analiza krzywych wysychania ma duże znaczenie w aspekcie poznania reżimu cieków i rzek oraz rezerw wód podziemnych. Krzywe te charakteryzują przepływ podstawowy rzek, a zatem ich charakterystyki w okresie deficytu opadowego. Tłumaczą wyczerpywanie zasobów wodnych warstw wodonośnych, pozwalają także obliczyć pojemność retencyjną zlewni. Stopień osłonięcia gruntu i gęstość roślin uprawnych wpływają na wielkość plonu i stanowią o przyroście biomasy w większości agrocenoz, a maksymalna pojemność retencji intercepcji Smaks. jest od niej bezpośrednio zależna. W modelu holenderskim (Makkink, van Heemst, 1975) przyjmuje się maksymalną pojemność retencji intercepcji w agrocenozach trawiastych jako połowę ich biomasy. Metody badawcze stosowane aktualnie w indywidualnych zlewniach badawczych można podzielić na dwie podstawowe grupy: 1) pomiary i obserwacja interesujących nas elementów hydrometeorologicznych i parametrów fizycznogeograficznych, opracowywanie ich wzajemnych współzależności oraz próba wnioskowania na ich podstawie o formie tych zależności w innych zlewniach; W Wielkiej Brytanii wprowadzono gęstość sieci cieków jako liczbę węzłów hydrograficznych (połączeń) na 1 km2 zlewni. Podobnie jak sieć cieków, tak i jeziora można scharakteryzować przez gęstość, tzw. jeziorność zlewni   . Pod tym pojęciem należy rozumieć obecność jezior w zlewni, określoną ilościowo jako łączna powierzchnia jezior i innych zbiorników wodnych. Rozwiązanie przyjętego równania filtracji polega na określeniu funkcji ciśnienia bądź swobodnego zwierciadła wód gruntowych wewnątrz obszaru (pola) filtracji. Schematyzacja geometrii obszaru filtracji jest zagadnieniem złożonym i zależy od wielu czynników (Procesy hydrologiczne, 1989) (p. rozdz. X). Współczynniki filtracji w zależności od rodzaju litologii warstwy wodonośnej przedstawiono w tabeli XII.1. Parowanie rzeczywiste w zimnej porze roku obejmuje w okresie bezśnieżnym parowanie lub sublimację z powierzchni roślin, parowanie lub sublimację z gleby oraz transpirację kutykularną roślin, a w okresie zalegania śniegu przede wszystkim parowanie lub sublimację z pokrywy śnieżnej i lodowej. Na rysunku IV.5 pokazano schemat modelu, który może być przykładem modelu integralnego podsystemu górnej części zlewni. W tym przypadku możemy wyróżnić dwa komponenty: powierzchni i gleby. Wejście do systemu to opad i warunki meteorologiczne, wyjściem są procesy, takie jak odpływ bezpośredni (suma odpływu powierzchniowego i podpowierzchniowego), zasilanie wód podziemnych oraz ewapotranspiracja. Każdy pojedynczy proces zachodzący wewnątrz systemu, w przypadku modelu integralnego, wymaga odrębnego opisu matematycznego. Poza tym występuje stała wymiana pary wodnej między powietrzem glebowym a powietrzem atmosferycznym. Na ogół jednak ilości wody przemieszczające się w postaci pary są w glebie niewielkie. Woda błonkowa jest związana siłami molekularnymi z cząstkami gleby. Dookoła cząstki gleby formują się błonki wody przyciąganej z bardzo dużą siłą. W miarę oddalania się warstw molekuł wodnych od powierzchni cząstki stałej, siły przyciągania maleją aż do zera w całkowicie nasyconej glebie. Przestrzenna skala wykorzystania modelu jest bardzo elastyczna, od pojedynczego profilu glebowego (badanie i opis infiltracji) do dużych obszarów obejmujących nawet kilka zlewni. Model jest w sposób ciągły rozwijany pod kątem możliwości zastosowań w nowych dziedzinach. SHE ma zintegrowaną strukturę modularną, dzięki czemu każdy z modułów można użytkować także rozłącznie. Struktura modularna pozwala na znaczną elastyczność w praktycznych zastosowaniach."
