,Unnamed: 0,sentence
8123,8123,"Juniorzy występujący w tegorocznych mistrzostwach świata juniorów do lat 17 (w sierpniu w Japonii) będą wykonywać auty nogą z ziemi zamiast wrzutów oburącz. Jeśli eksperyment powiedzie się, nowy przepis wejdzie w życie jeszcze przed mistrzostwami świata w USA - powiedział sekretarz generalny FIFA Sepp Blatter w wywiadzie dla belgijskiej gazety  ""Het Nieuwsblad"" . W Kraspolu pracuje się po osiem godzin, na trzy zmiany. Mężczyźni zarabiają od 6 do 12 milionów, dziewczyny-szlifierki - niewiele ponad 2 miliony. - Jak jednemu krasnoludkowemu magnatowi kazaliśmy zaprzestać działalności, to nic sobie z tego nie robił. Prokurator też nic nie wskórał - skarży się Józef Kalinowski, inspektor z terenowej stacji sanitarno-epidemiologicznej. Jeśli chcesz zabrać psa do lasu, nad jezioro, to tylko pod warunkiem, że był szczepiony na wściekliznę i termin następnego szczepienia nie minął. W lesie trzymaj psa na długiej smyczy, nie puszczaj go samopas. Nawet w posłusznym czworonogu może zwyciężyć instynkt - pogoni za zwierzyną. Gdy wróci z naderwanym uchem, nie będziesz wiedział, czy nie pokąsał go np. wściekły lis. Przez godzinę z boiska wiało nudą, a piłkarze prezentowali futbol plażowy. Przewagę mieli lubinianie, a goście grali wyjątkowo pasywnie. Jedynie czarnoskóry Tetteh starał się walczyć, jednak osamotniony niewiele mógł zdziałać. W 68. min, w odstępie 20 sekund, Zagłębie zdobyło dwie efektowne bramki i losy meczu zostały rozstrzygnięte. Majak - wicekról strzelców minionego sezonu - dopiero po raz pierwszy pokonał bramkarza w nowych rozgrywkach. Przyznaję, że trudno mi zrozumieć, jak można mówić z odkrytym czołem o obronie życia poczętego podpisując ustawę, której ostrze wymierzone jest w kobiety, które decydują się na samotne macierzyństwo. Jakoś łatwiej zrozumieć mi liberałów, którzy konsekwentnie głoszą, że są generalnie przeciw przywilejom podatkowym, nie jest tylko jasne, dlaczego nie wystąpili o zniesienie ulgi dla małżeństw. W księgarni oświatowej w Warszawie dowiedzieliśmy się, że po telewizyjnym apelu dyr. Sławińskiego sprzedaje się znacznie mniej podręczników. Jak poinformowała nas kierowniczka księgarni Małgorzata Brodacka, szczyt zakupów przypada zwykle na przełom sierpnia i września, ale sporo osób zaopatrzyło się w podręczniki już pod koniec czerwca. Zareagowali nadspodziewanie dobrze. Do działów kadr ustawiają się kolejki chętnych do zwolnienia. Już dziś wiadomo, że odprawy są zbyt hojne. Z pakietu socjalnego skorzystało w zeszłym roku 25,9 tys. osób, gdy program przewidywał zaledwie 12,4 tys. Na ten rok program przewiduje odejście 20 tys. osób. Ale w budżecie zaczęło brakować pieniędzy na odprawy, więc odejdzie pewnie tylko 11 tys. W gościnnym pokoju u Czapków zasiadają często naukowcy. W związku z urządzeniem przeciw stonce przyjechało więcej uczonych niż z okazji innych wynalazków. Pani Czapkowa zaścieliła stół świeżą ceratą, podała kotlety z dzika, a po obiedzie odbyło się sympozjum. Wszyscy chwalili dzieło, tylko pewien naukowiec z Instytutu Ziemniaka, który siedział pod oknem, stwierdził, że maszyna do stonki zniszczy kraj: splajtują fabryki, produkujące środki owadobójcze. W 460 punktach w kraju rozpoczęła się wczoraj sprzedaż rocznych obligacji państwowych o terminie wykupu 2 czerwca 1996 r. Państwo chce pożyczyć od obywateli tym razem ponad 530 mln zł. Wczoraj wystawiono na sprzedaż 5 mln 280 tys. 999 obligacji pierwszej serii o nominałach 100 zł. W wielu miastach widzieliśmy gigantyczne kolejki. - Od nowego roku będzie nowy katecheta. Teraz nie mam nikogo innego na jego miejsce. Zresztą nie sztuka wywalić kogoś z hukiem, trudniej jest przekonać nauczyciela, że nie nadaje się do pracy w szkole - mówi dyrektorka. Pytam, czy przekonała już kiedyś jakiegoś nauczyciela, że powinien zmienić pracę. - Tak. W zeszłym roku, poprzedniego katechetę, bo się nie nadawał do pracy z dziećmi - odpowiada dyrektorka. Etatowo mamy dziś prawie 130 tys. żołnierzy - mniej niż przed 1989 r. Ale w rzeczywistości jest ich jeszcze o 50 tys. mniej. Nie ma naszych obrońców czym karmić, za co szkolić. Nie ma nawet w co ubrać. Widać to na ulicy, każdy nosi mundur, jaki ma. Haszkowy Szwejk lepiej się prezentował. Najpierw prawica spierała się o to, jaka ma być. Zjednoczenie Chrześcijańsko-Narodowe chciało budować formację narodową, Porozumienie Centrum - chadecką, Konfederacja Polski Niepodległej - niepodległościową, PSL-Porozumienie Ludowe - ludową, Partia Konserwatywna - konserwatywno-liberalną, Unia Polityki Realnej - liberalną itd., itp. Nikt nie zamierzał ustąpić. I nie musiał. Obowiązująca w czasie wyborów 1991 r. ordynacja  ""bez progu""  każdemu dawała szansę. Rząd, który podpisał Pakt, upadł za sprawą  ""Solidarności"" , a wybory przyniosły klęskę negocjatorom tego dokumentu. Nowa ekipa miała nowe pomysły, m.in. projekt masowej komercjalizacji zapisany w  ""Strategii dla Polski"" . Za taką komercjalizacją - w myśl tezy, że ważna jest nie forma własności, lecz forma zarządzania - opowiadał się SLD w programie wyborczym. Kilka godzin wcześniej Wałęsa przyjął kwiaty od  ""postkomunisty""  Ryszarda Golucha (był dyrektorem Stoczni w latach 1983-87), obiecał prezesowi zgodną współpracę, także w ratowaniu Stoczni. Współpraca ma polegać na tym, że jeżdżąc po świecie Wałęsa będzie szukać pomocy. Pomoc ze świata jest Stoczni bardzo potrzebna. Do zamieszkanej przez 1,8 mln osób Barcelony przybędzie 180 ekip, liczących 9569 sportowców i 4537 działaczy oraz trenerów. W zawodach oficjalnie figurujących w programie weźmie udział 9309 sportowców, w konkurencjach pokazowych - 260. Imprezę obsługiwać będzie 11 tys. dziennikarzy i pracowników technicznych. Nad bezpieczeństwem i utrzymaniem porządku czuwać będzie 45 tys. funkcjonariuszy i 32 tys. pomocników. Wśród 65-tysięcznej publiczności oglądającej uroczyste otwarcie igrzysk będzie 40 najwyższych dostojników różnych państw. Budapeszteńska giełda ma i inne poważne problemy. Wobec niektórych z notowanych firm toczy się obecnie postępowanie upadłościowe. Poza tym techniczna strona dokonania zakupu papierów wartościowych pozostawia wiele do życzenia. Inwestorzy zagraniczni muszą wpłacić pieniądze z góry w nadziei, że biuro maklerskie wywiąże się ze zobowiązania. - Pan daruje, ale lodowców jeszcze nie dowieźli. Wiersze Jurija tym bardziej irytowały zwierzchników od poezji, że nie były ani sowieckie, ani antysowieckie. Były napisane tak, jakby świadomość społeczna w ogóle nie istniała. A to irytowało jeszcze i dlatego, że nie sposób było wskazać konkretne wersy, które należałoby usunąć lub przerobić we właściwym kierunku, tak aby wiersz był dla władzy radzieckiej do przyjęcia. Były na szczęście próby wyjścia z tego systemu. W Warszawie trzech absolwentów PWST - Adam Krawczuk, Rafał Rutkowski i Maciej Wierzbicki - nie czekając na iluzoryczne angaże założyło własną grupę Montownia, która okazała się rewelacją sezonu. W Radomiu Wojciech Kępczyński poświęcił cały budżet teatru na jedną, ale za to superprodukcję - musical  ""Józef i cudowny płaszcz snów w technikolorze"" , który odniósł komercyjny sukces roku. - Jest to nieunikniona konsekwencja trwającego około 45 dni okresu, który nazywamy  ""okienkiem serologicznym""  - wyjaśnia prof. Halina Seyferied z Instytutu Hematologii. - Krwiodawca może być zarażony HIV-em, ale jego organizm nie zdążył jeszcze wytworzyć przeciwciał. Nie można wtedy wykryć wirusa. Ale żadnej szarży kawaleryjskiej nie dane mu było zakosztować, choć na wojnę wyruszył konno. Niemcy atakowali ich z samolotów i czołgów. W sporządzanych na gorąco po kampanii wrześniowej zapiskach 19-latka wojnę przedstawia jako bezładną szamotaninę: nocne czuwania, nocne strzelania, jakieś rozkazy, rozbiegani kurierzy. Przyłączył się do grupy ułanów, którzy postanowili przedzierać się na Węgry, by walczyć dalej. ""Tylko uprzedzam, konia trzeba będzie samemu czyścić""  - przestrzegał rotmistrz. Beata Maksymow i Rafał Kubacki zwyciężyli w kategoriach open mistrzostw świata w judo, rozegranych w Hamilton. Drużynowym mistrzem Polski na żużlu została Sparta-Polsat Wrocław. Najlepszy koszykarz ligi NBA Michael Jordan ogłosił miesiąc przed rozpoczęciem rozgrywek, że kończy karierę. - Moja kariera sięgnęła szczytu. Więcej nie jestem już w stanie dokonać. Straciłem serce i chęć do gry - stwierdził Jordan. Bożena też nie ma z czego zwrócić pożyczki. Obie siedzą na garnuszku rodziców emerytów - byłego nauczyciela i byłego robotnika budowlanego. Urzędnik departamentu konsularnego i wychodźstwa w MSZ (nie życzy sobie, żeby wymieniać jego nazwisko) radzi: - Niech obie panie napiszą podania o umorzenie długu. Na początku przyszłego roku zbierze się specjalna komisja i je rozpatrzy. Często systemy filozoficzne, nauki i posłania wywodzące się z innych kultur z wielkim trudem trafiają do mieszkańców innego kręgu kulturowego. Okazuje się, że wystarczy tylko zmienić realia - zamiast klasztoru w Tybecie przedstawić blok na Ursynowie, a zamiast mistrza Zen Misia Puchatka - i wszystko okazuje się proste i mądre. Pod warunkiem, że zachowamy - jak Benjamin Hoff - poczucie smaku i taktu. DERRICK COLEMAN (26/209, New Jersey Nets - 6): Ostatnio więcej czasu spędza w sądach niż na parkiecie. Do spraw o pobicia i gwałty doszedł pozew rozwodowy żony. Właśnie dlatego skrzydłowy New Jersey Nets, który odrzucił 100-milionową ofertę swego klubu, zapowiada, że MŚ będą dla niego doskonałą ucieczką od rzeczywistości. A potem dowiedziałem się, że nie mogę nie pójść na obiad wydawany w restauracji przez znajomego Chenga, bo w czasie ostatniego spotkania znajomy dał mi twarz. - Gdybyś teraz nie przyszedł, on straciłby twarz - Cheng tłumaczył mi tę oczywistość cierpliwie, jak niezbyt rozgarniętemu dziecku. Na obiedzie usłyszałem, że pewnej mojej prośby Cheng nie jest w stanie spełnić. Moskwa nie tylko odrzuca proponowane  ""Partnerstwo""  przez NATO. Domaga się też pełnego udziału w decyzjach dotyczących Bośni, aspiruje do uczestnictwa w G-7 - grupie siedmiu najbogatszych państw świata, żąda zgody Zachodu na zwiększenie ponad limit wyznaczony przez międzynarodowy traktat liczby swych wojsk w europejskiej części kraju, wreszcie chciałaby mieć prawo weta wobec decyzji o rozszerzaniu NATO o państwa byłego Układu Warszawskiego. Rzecznik praw obywatelskich prof. Tadeusz Zieliński zwrócił się do Sądu Najwyższego o rozstrzygnięcie, kto - PKO BP czy skarb państwa - powinien zwaloryzować premie gwarancyjne przysługujące właścicielom książeczek mieszkaniowych. Rzecznik pyta również, czy sąd może jednoznacznie określić, w jaki sposób oblicza się jej wysokość. Mamy w piwnicy stary piec c.o. na koks i chyba będziemy zmuszeni zainstalować go na nowo i spalać w nim wszystko, co się da, bo będzie taniej. Tego samego zdania jest wielu naszych znajomych, którzy również mają ogrzewanie gazowe. Na całym świecie ten, kto korzysta z urządzeń ekologicznych, ma zniżki, a nawet ulgi podatkowe. U nas niszczy się to, co chroni przyrodę, aby tylko wyciągnąć z naszych kieszeni dodatkowe pieniądze. Przeprowadzenie sprawnej akcji jest niemożliwe, bo nie wiadomo, kto odpowiada za jej koordynację. Samym ratowaniem kieruje strażak, ale nikt nie odpowiada za zaplecze. Nie ma planów ratowniczych dla wydarzeń, które wymagają działań w paru województwach. Akcji takiej nie podoła też Krajowy System Ratowniczo-Gaśniczy, który istnieje tylko na papierze. Ten mord potępili wszyscy, prócz - rzecz jasna - jego sprawców. I wszyscy, z nimi włącznie, wiedzą, że może się powtórzyć. Tak długo, jak będą reżimy takie jak syryjski, gotowe terrorystów wspierać. I tak długo, jak będą ludzie wystarczająco zaślepieni nienawiścią i rozpaczą, by udzielać im wsparcia i schronienia. Razem z dorosłymi przed telewizorem siedziała ośmioletnia Magda, córka Andrzeja. - Płakała, kiedy tatusia przeciwnik ciągnął za głowę - wspomina nocne wrażenia dziadek. - Bo walczył nieczysto, bałam się, że zrobi coś tacie - tłumaczy Magda. Wszyscy we wsi znają Andrzeja Wrońskiego. Dwie dziewczynki siedzą na podwórzu i zakładają kolorowe wrotki. - Wiecie, kto to jest Andrzej Wroński?"
8516,8516,"Zaproszenie przedstawicieli powiatu gostyńskiego jest efektem ożywionych kontaktów gospodarczych, które zainicjowane zostały kilka miesięcy temu. Przypomnijmy, że w marcu do powiatu gostyńskiego przyjechali Klaus Behrens, burmistrz powiatowego miasta Hoxter oraz Horst Rosner, przedstawiciel samorządu gospodarczego tego miasta."
8658,8658,"Po meczu szkoleniowiec zadowolony był wyłącznie z wyniku. - W grze za dużo jest niedokładności, błędów w obronie, niecelnych podań. Widać, że czeka nas jeszcze sporo pracy. Poza tym, żeby zespół prezentował naprawdę solidny drugoligowy poziom, musi zostać wzmocniony trzema klasowymi piłkarzami - powiedział po meczu Makowiecki. - Na szczęście zawodnicy bardzo ambitnie trenują. W poniedziałek odbyli dwie ciężkie tury zajęć, przed dzisiejszym spotkaniem również nie próżnowaliśmy. Wspominając Grześka, wicedyrektor przypomina, że w gimnazjum miał obniżony zakres wymagań. W szkole zawodowej dokumenty nie były uaktualnione, toteż był traktowany na równi z pozostałymi uczniami. - Może właśnie dlatego w tym roku powtarzał drugą klasę - zauważa wicedyrektorka. - Nie sprawiał żadnych problemów wychowawczych. Był bardzo spokojny. Wiadomość o jego zaginięciu była ogromnym zaskoczeniem zarówno dla nauczycieli, jak i kolegów. Na razie jedyną koncepcją władz miasta, co do nowoczesnego kompleksu, jest sam pomysł jego budowy. Obok stadionu piłkarskiego na 15 tysięcy miejsc z zadaszoną całą trybuną mają być dwa boiska treningowe, hala widowiskowo-sportowa i kryta pływalnia. Była też mowa o tym, że cały kompleks ma służyć radomskim klubom. Ośrodek Interwencji Kryzysowej od kilku miesięcy uczestniczy w akcji ""Alkohol - nieletnim wstęp wzbroniony"". Jednym z działań było złożenie wizyt w 11 sklepach sprzedających alkohol. Próbowano tam przy udziale osoby wyglądającej na nieletnią kupować piwo. W 10 sklepach sprzedawcy odmówili, żądając okazania dokumentów, w jednym przypadku alkohol sprzedano. W pierwszym bloku przewidzianych jest 97 mieszkań jedno-, dwu - i trzypokojowych. Najwięcej, zgodnie z zapotrzebowaniem, będzie lokali dwupokojowych o powierzchni około 44 metrów kwadratowych. Budynek będzie niepodpiwniczony, ale każde mieszkanie będzie miało balkon i pomieszczenie gospodarcze. Dodatkowo, aby obniżyć koszty eksploatacji, mieszkania będą w pełni opomiarowane, a budynek będzie posiadał kolektory słoneczne. Sześć zarzutów o charakterze korupcyjnym postawiła wrocławska prokuratura zatrzymanemu we wtorek rano, byłemu II-ligowemu sędziemu piłkarskiemu Januszowi O. z Radomia. Janusz O. przyznał się do stawianych mu zarzutów i bez poręczenia majątkowego dziś wyszedł na wolność. Januszowi O. postawiono zarzuty przyjmowania obietnic korzyści majątkowych oraz przyjmowania korzyści majątkowych w zamian za korzystne rozstrzygnięcia meczów. To już trzeci w ciągu ostatnich dwóch tygodni podpisany przez ""Bumar"" kontrakt na dostawy broni i amunicji do Iraku. W sumie wartość umów wynosi 53 mln dolarów. Można się spodziewać, że dzięki tym zamówieniom poprawi się sytuacja finansowa skarżyskiego ""Mesko"". Spora część kwiatów zasadzonych w Kielcach wiosną - ginie. Ale nie usychają, ktoś wykopuje je nocami. Z Urzędu Miasta wyniesiono kiedyś muszlę klozetową i gaśnicę, a z poczty klienci kradną nawet miseczki do nawilżania znaczków i czyste blankiety. Z urzędów i różnych instytucji ginie nawet papier toaletowy. – Ponieważ to bardzo duża kwota, oferujący sprzęt poprosił o zaliczkę w wysokości czterech tysięcy złotych – mówi Aneta Łyżwa, oficer prasowy Komendy Powiatowej Policji w Końskich. – Konecczanin wysłał pieniądze na podane konto. Niestety, ładowarki nie otrzymał. Gdy telefon sprzedawcy nie odpowiadał, mężczyzna powiadomił policję. Prawdopodobnie padł ofiarą internetowego oszusta. 20-letni student runął z poręczy na trzecim piętrze schodów kieleckiej politechniki. Trafił do szpitala – poinformowali policjanci. Do nieszczęścia doszło w poniedziałek około godziny 15. Z pierwszych informacji wynika, że młody człowiek chciał zjechać po poręczy i stracił równowagę. Dziś lekarze nie zgadzali się jeszcze, aby z młodym człowiekiem rozmawiali stróże prawa. Drugi dwumecz z łódzkimi drużynami rozegrają dziś w Skierniewicach nasi drugoligowcy. Piłkarze KSZO Ostrowiec o godzinie 11 rozpoczną sparing z Łódzkim Klubem Sportowym, a HEKO Czermno o 14.30 z Widzewem. Przed tygodniem piłkarze KSZO pokonali Widzew 4:1, a HEKO uległo ŁKS 1:5. Dzisiejsza konfrontacja z łódzkimi zespołami, które mają pierwszoligowe aspiracje, zapowiada się niezwykle ciekawie. Mostek na strumieniu został przez gminę odbudowany po ostatniej powodzi. Mieszkańcy oceniają, że wytrzyma najwyżej do następnej większej wody. - A ponad 84,5 tysiąca złotych z dotacji celowej na usuwanie szkód po powodzi pod koniec 2003 roku gmina musiał zwrócić jako niewykorzystane - denerwują się. Na Podkarpaciu oficjalnie kampania żniwna zacznie się w przyszłym tygodniu. - Szybciej, bo słońce bardzo przyspieszyło dojrzewanie zbóż. Ziarno będzie gorsze, bo mniej wilgotne - mówi Ryszard Gonczowski z oddziału terenowego Agencji Rynku Rolnego w Rzeszowie. Skup wolnorynkowy zbóż zaczyna się w sierpniu. Specjaliści przewidują, że cena za tonę pszenicy nie przekroczy 380 złotych. Akcji przyglądały się władze powiatu i gminy. - Przećwiczony epizod pozwala nam się przygotować na ewentualne prawdziwe niebezpieczeństwo. Wtedy już będzie wiadomo kto ma jakie kompetencje przy ewentualnej akcji antyterrorystycznej - powiedział brygadier Krzysztof Żywczyk, zastępca komendanta straży pożarnej w Stalowej Woli. Jeśli gracze nie zmienią swojej decyzji, sytuacja naszego trzecioligowca stanie się jeszcze bardziej dramatyczna. Po dziesięciu rozegranych kolejkach MG MZKS ma zaledwie dwa punkty. Nie wygrał jeszcze meczu w rundzie jesiennej i plasuje się na przedostatnim miejscu w tabeli. W najbliższą niedzielę podopieczni trenera Jerzego Rota podejmować będą na własnym boisku Klub Sportowy Paradyż. Ratownicy z całego województwa w ramach ćwiczeń w poszukiwaniu ofiar utonięć badali dno kieleckiego zalewu. W tym celu zanurzali kamerę, taką jakiej używano między innymi do badań wraku Titanica. Na specjalnym urządzeniu na brzegu można było obserwować co kryje kielecki zalew. – Generalnie zbiornik nie jest bardzo zanieczyszczony, ale gdzieniegdzie natrafialiśmy na puszki i słoiki – mówili ratownicy. Najpiękniejsze naszej ziemi. Sześć pięknych dziewcząt rywalizowało w Miejsko-Gminnym Ośrodku Kultury w Małogoszczu o tytuł Miss Regionu Jędrzejowskiego i Włoszczowskiego. Zwyciężyła Monika Lasek z Małogoszcza. Zmiana decyzji. Leszek Kapcia, burmistrz Jędrzejowa, zmienił swoją decyzję dotyczącą odwołania Marka Bogusławskiego ze stanowiska kierownika Zakładu Podstawowej Opieki Zdrowotnej w Jędrzejowie. Wiemy kto zrobi studium wykonalności dla budowa szlaku kolejowego Warszawa – Rzeszów przez Kolbuszową na odcinku Skarżysko-Kamienna – Sandomierz – Ocice – Rzeszów. Jako jedyne kryterium przy wyborze oferty postawiono najniższą cenę, którą zaoferowało Centralne Biuro Projektowo-Badawcze Budownictwa Kolejowego Kolprojekt, warszawska spółka z ograniczoną odpowiedzialnością. Jest reżyserem ""Idola"" i twórcą festiwalu ""Trendy"". O kielczaninie mówi się, że dzięki niemu na polskiej scenie muzycznej pojawiły się ""młode wilki"" - artyści, których kiedyś będzie się z całą pewnością nazywać gwiazdami i których miliony Polek i Polaków będą starali się naśladować. Zakup 10 autobusów planuje Miejskie Przedsiębiorstwo Komunikacji. Szkopuł w tym, że nie ma wystarczająco dużo pieniędzy i liczy na pomoc miasta. A władze Kielc nawet nie myślą pomagać... Z zamiarem uzupełnienia marnego i bardzo sędziwego już taboru kieleckich autobusów zarząd spółki MPK nosił się już od dłuższego czasu. Plany są duże, bo aż 10 używanych autobusów niskopodłogowych miałoby wkrótce jeździć po kieleckich ulicach. O godzinie 13 w Urzędzie Miasta w Kielcach rozpocznie sie klojene spotkanie w sprawie prywatnych przewoźników. Weźmie w nim udział starosta kielecki, Zenon Janus. Organizatorem spotkania jest wiceprezydent Kielc, Czesław Gruszewski. Na ostatnim spotkaniu ustalono, że busy będą mogły zatrzymywać się w centrum Kielc na trzech dodatkowych przystankach, a przewoźnicy zadeklarowali, że pokryją 50 procent kosztów ich przygotowania. Książka o wojennych losach Kielc mówi o wkroczeniu Niemców do Kielc we wrześniu 1939 r., funkcjonowaniu niemieckich władz administracyjnych w okresie okupacji, zagładzie ludności żydowskiej, życiu gospodarczym i społecznym, warunkach życia, szkolnictwie, kulturze oraz prześladowaniach i zbrodniach na ludności polskiej i ruchu oporu. To obowiązkowa lektura dla każdego kto interesuje się historią miasta. 86 milionów złotych na budowę 200 kilometrów kanalizacji i 80 kilometrów wodociągów chce wytargować z unijnego Funduszu Spójności (w ramach programu „Infrastruktura i Środowisko”) województwo świętokrzyskie. Chodzi o inwestycje w dziesięciu gminach z rejonu Gór Świętokrzyskich. Projekt prac został już przygotowany przez Związek Gmin Gór Świętokrzyskich. Podczas uroczystego otwarcia we wtorek były obecne władze gminy Brody, poseł Krzysztof Lipiec, ksiądz Stanisław Kuśmierczyk, proboszcz miejscowej parafii, który poświęcił pomieszczenia przedszkola. Wcześniej stosowną uchwałę Rady Gminy o powołaniu przedszkola odczytał Jerzy Stąporek, jej przewodniczący. Dzieci ze szkoły przygotowały program artystyczny, na zakończenie uroczystości. O podobne przedszkole zabiegają między innymi mieszkańcy Tychowa Starego w gminie Mirzec, na razie bezskutecznie. Trenerzy cały czas obserwują zawodników i nie zdecydowali, kto znajdzie się w podstawowej szóstce. W zgodnej opinii sztabu szkoleniowego radomian, wszyscy mają równe szanse. O tym, czy faktycznie wszyscy grają na równym poziomie przekonamy się już w czwartek, obserwując pierwsze towarzyskie spotkanie radomian na własnym terenie z węgierskim VRCK Kazincbarcika. Miało do tego dojść w maju przyszłego roku - Bielecki i Tkaczyk mieli za w sumie 300 tysięcy euro odejść z Magdeburga. Oba kluby porozumiały się w tej sprawie już kilka miesięcy temu. Ale menażer klubu z Mannheim nalegał, aby do transferu doszło już teraz. Wczoraj dopiął swego, chociaż musiał sporo dołożyć do umówionych wcześniej 300 tysięcy. Pierwsze dodatkowe pociągi ruszą w nocy z czwartku na piątek z 5 na 6 kwietnia. Świąteczne połączenia zapewnią pasażerom możliwość dotarcia we wszystkie możliwe zakątki naszego kraju, do których docierają pociągi dzienne i nocne. Niestety, mieszkańcy naszego regionu, by skorzystać z dodatkowych pociągów będą musieli udać się na ""przesiadkę” do Dębicy lub Rzeszowa. Wychowanek tarnobrzeskiej Siarki, Sławomir Walski, jest postacią znaną w podkarpackim środowisku piłkarskim. Ostatnio przed pół roku przebywał poza krajem, konkretnie w USA, gdzie pracował i kopał piłkę w polonijnym zespole Jagiellonii Chicago. Walski kopał piłkę w Siarce Tarnobrzeg, Stali i Tłokach Gorzyce, także w drugoligowych Błękitnych Kielce. Paskudna kontuzja przerwała jego karierę piłkarską, wziął się za trenerkę, i nie myślał, że będzie jeszcze piłkarzem i to w Stanach Zjednoczonych!"
8881,8881,Jednocześnie burmistrz gminy w Pelplinie zwrócił się o pomoc finansową związaną z organizacją wizyty Jana Pawła II. Powiat Kartuzy w ramach pomocy zaoferował 10000 zł z przeznaczeniem na pokrycie kosztów zakupu płyt jumbo w celu utwardzenia dojść i parkingów. Po wizycie papieża płyty mają zostać zwrócone powiatowi kartuskiemu.
