,Unnamed: 0,sentence
83,83,"We Francji odbyły się 18. już mistrzostwa świata w pluciu na odległość pestkami melona. Zwyciężyła po raz pierwszy kobieta, 22-letnia Portugalka. Uzyskała ona wynik siedem metrów 53 centymetry, pokonując w ten sposób 54 rywali. Daleko jej jednak do pobicia rekordu świata należącego do francuskiego emeryta, który uzyskał kiedyś wynik dziesięciu metrów i 46 centymetrów."
94,94,"– zapytała psycholożka. Wszyscy pacjenci byli po imieniu, bo terapeutka tak kazała, ale ona sama pozostała „panią magister”. – Stara nie pozwala – odpowiedziała. – Stara, czyli... – Moja matka. – To brzmi o wiele lepiej. Używajmy ładnych określeń – pouczyła pani magister. Mówiła powoli i wyraźnie. – Dlaczego twoja mama zabrania używania pomadek?"
96,96,"– zapytał. – Yes. Henryk szykował się, by wypowiedzieć następne zdanie, ale spojrzał na książkę. – Historia myśli socjologicznej – przeczytał tytuł. – Polak – bez zdziwienia powiedziała młoda kobieta. – Nie musimy gadać po angielsku. Myślała, że mieszka w Berlinie, i ucieszyła się, że jest przyjezdnym ze Szczecina. – Dobrze – powiedziała Jenny. Kupił ją. Kupił tak, jak kupuje się jałówkę, by mieć później cielaka i mleko. To zdanie mama Henryka powtarzała po polsku, dopiero potem przechodziła na jidysz. Zapamiętał. Nie chciał mieć krowy. Potomstwa też nie, a zresztą kobieta, którą odnalazł, miała już pięćdziesiąt trzy lata. Musiał jednak zapłacić. Wyłączył telewizor, czując, że jeszcze chwila i od świątecznego patosu wyrosną mu skrzydła husarskie. W kilka dni po święcie armii do Marka zatelefonowała Beata: u koleżanki z żonatym narzeczonym coś się stało i tylko on mógł pomóc. Zapytał, czy ma wziąć narzędzia: spodziewał się, że będzie musiał naprawiać kran lub piecyk. Beata zaprzeczyła. W tle słyszał monotonny płacz. Pod koniec tygodnia zaczął jej szukać. Zadzwonił do szpitala w porze wieczornej. – Jenny?"
136,136,"- to jej głos. Poczuł na piersi ostrza noży. Kątem oka dostrzegł pastora. Usłyszał: Hedwiga, nie wtrącaj się. W stodole spostrzegła zarys postaci w nieheblowanych deskach. Objaśnij. Kobieta pierze nad balią na tarce mężowskie koszule a może gacie. Płacze. Przez niego. Za dużo wiesz - powiada Maria bez zdziwienia. A te napisy?"
137,137,"Maria odczytuje swoje pismo sprzed lat: Rana prana z rana. Popatrz na mnie tymi swoimi ślepiami - mówi kobieta. Wsuwa się pod głowę leżącego, błądzi palcami po jego twarzy. Nawet o tym nie śniłam, przeznaczenie, znaczenie, zna-czenie. Co to jest - czenie?"
203,203,"H.S.: Panie marszałku, dzisiejsza Rzeczpospolita informuje, że żona wiceministra pracy współpracuje z Work Service (to jest firma senatora Tomasza Misiaka), a resort przygotowywał korzystne dla tej firmy przepisy. To być może z tego będzie kolejna afera. Natomiast pan na konferencji prasowej ostatnio mówił... przypomniał swój własny projekt sprzed 2 lat... M.B.: Karta Standardów Politycznych, tak?"
242,242,"Ranni zostali przewiezieni do siedmiu szpitali w Łodzi i Zgierzu na obserwację. Najpoważniej ranne zostały: 54-letnia kobieta, która ma uraz miednicy i 11-letnia Emilka - doznała urazu szyi. Ich życie nie jest zagrożone. Henryk Sadurski, inżynier metalurg, nie ma pracy od kilku lat. - Szukałem, ale bez skutku. Teraz będzie gorzej, bo niemal każdy pracodawca pyta, czy mam prawo jazdy. Ja stracę je już za kilkanaście dni. Moje szanse na znalezienie zatrudnienia będą równe zeru - mówi Sadurski. - Sąsiedzi zaalarmowali mnie w środku nocy. Powiedzieli, że dom płonie. Nie trafiałem w klawisze telefonu - krzyczałem sam do siebie - opowiada Wilczewski. Dom stał w środku wsi. Tuż obok innych drewnianych zabudowań. Udało się uniknąć przeniesienia ognia, nie było na szczęście ofiar. Ekspertyza potwierdziła podpalenie. - Na zasadzie współpracy mamy zamontowany w komendzie terminal i jak się coś dzieje, to przyjeżdża policja - zareklamował się Sławomir Trofimiuk (36 l.), szef ochrony Hetmana. - Czy to prawda, że w komendzie jest terminal i jak mi się włączy alarm, to przyjedzie policja?"
260,260,"- płacze Iwona W., matka trzynastolatki. - Agatka mówiła, że to ją strasznie bolało, ale nie mogła nawet pisnąć... Zrozpaczona matka nie może sobie darować, że nie odczytała wezwania na pomoc w słowach dziecka. Zimą bywało, że nie jadła tygodniami. - Jadłam śnieg - mówi pani Jadwiga. - No a co miałam zrobić, jak ja sama samiusieńka. Wita nas w dziurawych papuciach, przez które prześwitują odmrożone palce. Nie pamięta, kiedy ostatnio badał ją lekarz. - Ja nie dam rady pieszo do Brańska chodzić - popłakuje . Chwilę później 80-letni wiadukt nad torami kolejowymi na ulicy Brzezińskiej w Łodzi przestał istnieć. Codziennie wiaduktem jeździło wiele tysięcy samochodów przemierzających trasę Łódź - Warszawa. Wiadukt nie był jednak w stanie wytrzymać obciążenia większego niż 30 ton. Dlatego zdecydowano się go rozebrać. Nowym będą mogły przejechać nawet 80-tonowe samochody. To wyjątkowa kobieta. Dlatego chciał się jej oświadczyć w niezwykłym miejscu. Grzegorz Jakubiak (25 l.) wręczył swej wybrance pierścionek na kopule centrum handlowego w Szczecinie!"
275,275,"Wielu w wyobraźni już widziało siebie na ślubie roku. Premier w eleganckim czarnym fraku, Jolanta Szczypińska w bieli z bukietem czerwonych róż. Prezydent jako świadek. Relacje na żywo w telewizji. Gwiazdom tradycyjne imiona nie podobają się, bo są pospolite. Chcą, by dziecko się wyróżniało. Tak było w przypadku 5-letniej Jaśminy, córki Doroty Lanton (36 l.) z ""Klanu"". - To imię pachnie kwiatami i wyróżnia córkę, która ma nazwisko męża: Nowicka. Gdyby była Kasią czy Anią, byłaby zbyt pospolita, to imię świetnie do niej pasuje - mówi aktorka. W Polsce jest jeszcze mało popularny, ale można go już skopiować z Internetu. - Jeszcze dziś ściągnę go z sieci - przekonuje Przemek, gimnazjalista z Zielonej Góry. Przemkowi już kilka razy nauczycielka zabierała telefon, bo bawił się nim podczas lekcji. - Teraz będę bez problemu puszczać sygnały do kolegi w czasie lekcji - cieszy się chłopak. Szykuje się przednia zabawa. Białystok. Rośnie ujawniany przemyt na wewnątrzunijnej granicy z Litwą, maleje na ""uszczelnionej"" granicy z Białorusią, która jest zewnętrzną granicą Unii Europejskiej - tak podlascy celnicy oceniają dwa lata od akcesji do UE na granicy w północno-wschodniej Polsce. Z ich wyliczeń wynika, że od akcesji Polski i Litwy, wykrywany przemyt papierosów na tej granicy jest o 20 procent większy, niż przed przystąpieniem obu krajów do UE. Ruszyła zbiórkana odbudowę kościoła. Pomagają wszyscy. Pół wieku temu ojciec Łukasz Semik, karmelita, zaczął odbudowywać ze zniszczeń wojennych kościół św. Katarzyny w Gdańsku. Pożar sprzed kilku dni 50 lat jego pracy zamienił w proch. - Zobaczyłem płomienie trawiące dach św. Katarzyny. Nie da się opisać tego, co czułem. To jakby płonęło mi 50 lat życia - opowiada ze łzami w oczach. - Znam bardzo dobrze ks. Michała i wiadomość o tym, że był agentem SB spadła na mnie jak grom z jasnego nieba - zawiesza głos ks. Adam Boniecki, redaktor naczelny ""Tygodnika Powszechnego"". Dokumenty IPN świadczą jednak przeciwko ks. Michałowi Czajkowskiemu. Ks. prof. wykładający biblistykę na Uniwersytecie Kardynała Wyszyńskiego przez ponad 20 lat był agentem bezpieki o pseudonimie Jankowski. Donosił m.in. na ks. Jerzego Popiełuszkę. Osobisty sekretarz Benedykta XVI, ks. Georg Gaenswein (49 l.) znów jest w świetle jupiterów. Tym razem, tak jak dwa tygodnie temu przewidział ""Super Express"", sekretarz zachwyca miliony Polaków. - Cieszę się, że wreszcie doszło do pielgrzymki w waszym kraju. Wasza wiara jest naprawdę żywa. I naprawdę imponująca - powiedział do dziennikarzy zgromadzonych w Pałacu Prezydenckim prałat Georg, gdy proszono go o komentarz. Ksiądz Gaenswein nie zawiódł. Obecna lokatorka mieszkania na Bohaterów Getta od kilku lat. Wcześniej nie zdarzały się tam przypadki przemieszczania przedmiotów. Ale działy się inne rzeczy. - Tam coś musi być - mówi sąsiadka mieszkająca piętro niżej. - To mieszkanie jest chyba jakieś pechowe. Kiedyś mieszkała tam starsza pani. Umarła. Następna lokatorka wyprowadziła się bardzo szybko. Tegoroczna maturzystka sopockiego ogólniaka chciałaby po skończeniu szkoły średniej dostać się na Uniwersytet Gdański. Pod uwagę bierze takie wydziały jak politologia, pedagogika, historia, dziennikarstwo i filozofia. - Najbardziej chciałabym się dostać na politologię - wyjaśnia. Małgorzata Tusk, mama Kasi: - Uważamy z mężem, że Kasia powinna robić w życiu to, co lubi i co będzie sprawiać jej przyjemność. Nie chcemy jej niczego narzucać. - On czuje się już na tyle mocny, że już nawet o własnych siłach poszedł do szkoły odebrać świadectwo - tata z radością obserwuje przemianę Wojtka. - W walce z rakiem stan psychiczny i nastawienie człowieka jest bardzo ważne. A sam Wojtek utwierdza bliskich w przekonaniu, że wszystko będzie dobrze. - Nigdy nie płaciłem za informacje o zgonach - zapewnia Witold Skrzydlewski, potentat w branży pogrzebowej w Łodzi. Przedsiębiorca zeznawał wczoraj przed sądem w kolejnym dniu procesu ""łowców skór"". Nazwisko właściciela największej w Łodzi firmy pogrzebowej przewijało się w śledztwie dotyczącym handlu informacjami o śmierci pacjentów. Prokuratura nie przedstawiła mu zarzutów. Oskarżeni sanitariusze i lekarze twierdzą, że Skrzydlewski wypłacał im pieniądze. Dla dr. Joe Townsenda i jego zespołu była to najdłuższa doba w ich życiu. Liczyła się precyzja, czas i niezwykły kunszt lekarzy, którzy przez wiele godzin mieli w swoich rękach życie tych dziesięciomiesięcznych dziewczynek. - Trzeba było odbudować wiele ich wewnętrznych organów - tłumaczyła po zakończonej sukcesem operacji rzeczniczka szpitala Janet Dotson. - Ale mamy nadzieję, że najgorsze jest już za nimi. Teraz może być już tylko coraz lepiej. Tym, którzy tu pozostaną na następny turnus, pozostaną obserwacje, badania pola magnetycznego, atmosfery i inne naukowe czynności. To one niemal bez reszty wypełniają czas Polakom w tej wiecznej zmarzlinie. Ale nasi nie są pozbawieni kontaktu z krajem. Internet dotarł i do tej opuszczonej przez ludzi części kuli ziemskiej. Anglicy upodobali sobie polskie kiełbasy, gołąbki, bigos, pieczywo, a nawet mleko. Uwielbiają nasze ogórki kiszone i marynowane grzybki. Polacy zaczynają się cenić. Kiełbaska palce lizać!"
286,286,"Sekretarz Łapa społecznie działa w poradni małżeńskiej, ale z podobnym postępowaniem kobiety nie spotkał się. - Normalnie zraniona kobieta wstydzi się, dusi to w sobie, szuka porady u przyjaciółki, ale nie upublicznia wszystkiego!"
289,289,"Michał ""Lonstar"" Łuszczyński, znawca i najsłynniejszy polski wykonawca muzyki country: - Pierwsze słyszę, że coś takiego powstało. Nie jestem przeciwko gejom. Ale to, co wyprawiają, to już przechodzi ludzkie pojęcie. To jątrzycielstwo i prowokacje. Geje robią wokół siebie szum, żeby tylko się wypromować. I nieważne czyim kosztem. Zachowują się jak jacyś ekstremiści, niszcząc piękną tradycję. Szkodzą tym tylko ludziom i budzą moją odrazę. 2. Świadectwa pracy i dokumenty niezbędne do ustalenia uprawnień (np. w przypadku pracy na pół etatu, zaświadczenie o dochodach brutto, w rozbiciu na miesiące pracy). 3. Dyplom, świadectwo ukończenia szkoły i dokumenty świadczące o kwalifikacjach, np. świadectwa ukończenia kursu lub szkolenia. 4. Dokument o ewentualnych przeciwwskazaniach do wykonywania określonych prac. 5. Numer NIP. 6. Legitymacja ubezpieczeniowa. A przecież do niedawna Camilla była postrzegana jako zła kobieta, odpowiedzialna za rozpad małżeństwa Karola z Dianą Spencer, ""królową ludzkich serc"". Jednak gdy w zeszłym roku następca tronu wreszcie ją poślubił, Brytyjczycy zaczęli się do niej przekonywać. Bo towarzyszyła mężowi we wszystkich zagranicznych wizytach i nie stała się źródłem skandali. Może też wziąć pożyczkę na uruchomienie działalności gospodarczej. - Ale nie wiem, czy nadaję się do prowadzenia własnego interesu - wyznaje. - Chociaż z drugiej strony, jak człowiek nie spróbuje, to się nie dowie - dodaje. Straciłeś pracę?"
294,294,"- Zając już w czasach pogańskich uważany był za symbol płodności i zmartwychwstania. Oddawano mu hołd w czasie obrzędów ku czci Bogini Wiosny. Potem stał się elementem symboliki chrześcijańskiej charakterystycznej dla Wielkanocy - wyjaśnia Elżbieta Kaczmarek (57 l.), etnograf z Muzeum Warmii i Mazur w Olsztynie. Pierwsi pojawili się tam pseudokibice Śląska, prawie 25 osób. Około setki fanów Zagłębia dojechało dwoma autokarami. Ustawka po kilku minutach została przerwana przez przejeżdżający tamtędy patrol policyjny. - Policjanci wezwali posiłki i sami zaczęli wyłapywać uczestników bójki - opowiada Krzysztof Zaporowski z dolnośląskiej policji. - Nikt poważnie nie ucierpiał, 28 osób trafiło do aresztu - dodaje. - Mój syn Adaś wczoraj skończył 10 miesięcy, a ja go widziałam tylko raz, zaraz po urodzeniu - szepcze przez łzy Beata Gronowska z Olsztyna. - Wczoraj od redakcji ""Super Expressu"" pani Beata dostała zdjęcie swojego syna. Jest to jedyne zdjęcie Adasia, jakie ma jego rodzina. - Z miłych ludzi zmienili się w potwory!"
295,295,"- wzdryga się kobieta. - Trzymali nas w chlewiku... I głodzili. Dziennie dostawałam kromkę chleba i trochę wody. Żywiłam tym Dominikę. Dziewczynka drży widząc zdjęcia oprawców. Wygłodzona, śmiertelnie wystraszona kobieta godziła się na wszystko. Kiedy przestępcy przewieźli ją do jednego z domków kempingowych w Jantarze, na okolicznych targowiskach pracowała dla nich. - Postaram się. Zwycięstwo z Groclinem bardzo nas podbudowało. Apetyt na mistrzostwo mamy coraz większy i nie możemy sobie pozwolić na moment dekoncentracji, bo na pasach zawsze jakiś wypadek może się zdarzyć - żartuje ""Wdowiec"". - Sami sobie zawiesiliśmy wysoko poprzeczkę i teraz musimy ją przeskoczyć. Gramy u siebie, przy pełnym stadionie, na pewno jesteśmy faworytem i mam nadzieję, że poradzimy sobie z tą presją. - Przetrwaliśmy wielką powódź, gdy było tu dwa metry wody, ale teraz będzie trudniej - tłumaczy. Identyczna sytuacja jest w każdej kamienicy wzdłuż trasy. Mieszkańcy grożą, że zablokują ulice. Zdenerwowani są także kierowcy. Z jednym z nich, Witkiem, rozmawialiśmy przez CB-radio. - Wjechałem do Wrocławia około 7 rano. Zbliża się południe, nie wiem, ile jeszcze zajmie mi droga - tłumaczy. Teraz niezbędny jest zakup protezy. Tylko dzięki niej Ania wróci do normalności. Ale rodziców na tę normalność nie stać. - Potrzebujemy ok. 45 tys. zł na protezę. Do tego rehabilitacja - mówi ze smutkiem Joanna Trzcionka, mama Ani. Choroba Ani zaczęła się niewinnie. Dziewczynę bolało kolano. Diagnoza lekarzy okazała się bolesna. Rak kości udowej. Uroiła sobie, że lekarze chcą ją zabić. Po powrocie do Polski Gronowska wraz z mężem zaczęła walczyć o sprowadzenie syna do kraju. O tych dramatycznych wydarzeniach i staraniach Gronowskich, aby Adaś wrócił do Polski pisaliśmy w styczniu. Od 8 miesięcy o sprowadzenie Adasia starają się również nasza ambasada w Atenach i polskie Ministerstwo Spraw Zagranicznych. Chłopiec przebywa w greckim przytułku prowadzonym przez organizację o złej reputacji. Zdążyć... W Polsce są cztery ośrodki, w których przeprowadza się transplantacje serca - w Zabrzu, Krakowie i dwa w Warszawie. Chirurgiczna część zabiegu wymaga umiejętności na średnim poziomie. Trudniejsze jest przygotowanie pacjenta do takiej operacji, znalezienie dawcy, transport narządu, a potem utrzymanie przeszczepu. Przygotowanie jest trudne, bo większość pacjentów choruje na serce wiele lat i do schorzenia podstawowego dochodzi niewydolność innych narządów, zwłaszcza nerek, płuc itp. - Wygląda to, jakby ktoś walcem przejechał, jak po linijce, kłos w kłos - opowiadała Zina Tarasewicz (73 l.), która jako pierwsza zauważyła kręgi. - Myślałam, że ktoś w szkodę wlazł sąsiadowi. Ale o mało zawału serca nie dostałam, kiedy zapuściłam się w głąb pola. Kręgi zdążyła już obejrzeć cała wieś. Zbigniew Religa zaapelował, by protestujący pracownicy służby zdrowia wrócili do pracy. - Większość postulatów strajkujących została spełniona - tłumaczył. Lekarzy to nie przekonuje. - Strajk nie zostanie przerwany. Nasze żądania są jasne - domagamy się 30 proc. podwyżki wynagrodzeń w tym roku. Ten program i słowa premiera to obietnice. Nikt nie przedstawił nam konkretnych wyliczeń. Nadal nie wiemy, skąd rząd zamierza te 5 mld wziąć - twierdzi Krzysztof Bukiel. Osoby, które nie otrzymały kart kibica i po mundialu nie są im już one potrzebne, powinny napisać pismo do PZPN, w którym - bardzo grzecznie - poproszą o zwrot pieniędzy. Powodem jest fakt niewywiązania się przez związek z umowy mówiącej, że karty kibica zostaną wydane kibicom wraz z biletami. - Czegoś takiego jeszcze nie widziałem - opowiada naoczny świadek policyjnej akcji. - Nagle jak spod ziemi wokół pojawiło się z 50 radiowozów, a wokół zaroiło się od policjantów w kominiarkach i z karabinami maszynowymi. Filmowa ""Ekstradycja"" to przy tym pestka. Sebastian S. ""Rakieta"" (29 l.), najgroźniejszy śląski bandyta, oskarżony m.in. o zabójstwo dwóch konwojentów w Sosnowcu, w piątek został deportowany z Hiszpanii do Polski. Przyleciał rejsowym samolotem. Towarzyszyli mu polscy policjanci ze specjalnego wydziału zajmującego się deportacją z Komendy Głównej Policji. Sytuacja jest nietypowa, nawet jak na warunki amerykańskie. Kiedy zdarzy się, że dzieci zobaczą kochających się w łóżku rodziców, może to dla nich być wielkim przeżyciem. A gdyby tak zobaczyły Jona i Michaela?"
334,334,"54-letni mężczyzna sprzedawał auta pozostawione w komisie, ale nie rozliczał się z pieniędzy. Dziewięć osób, nie mogąc doczekać się pieniędzy za sprzedane samochody, doniosło na oszusta do policji. Funkcjonariusze zabezpieczyli na terenie autokomisu jeszcze kilkanaście innych aut, które zwrócili właścicielom. Prowadzącemu autokomis grozi do 8 lat więzienia. Włodzimierz Czarzasty (46 l.) szefuje Stowarzyszeniu Ordynacka, choć po aferze Rywina część działaczy była temu przeciwna. Jest wpółwłaścicielem Wydawnictwa Muza SA. Robertowi Kwiatkowskiemu (45 l.) byłemu prezesowi TVP, wiedzie się gorzej. Po aferach Rywina i Orlenu kontrahenci zaczęli uciekać z jego Grupy Doradztwa Strategicznego. Wspólnik Kwiatkowskiego złożył w sądzie wniosek o likwidację firmy. Pociąg relacji Konin - Wrocław stał akurat na pobliskiej stacji. Ruszył, gdy kierowca ciężarówki go nie widział. - Ciężarówka nie zatrzymała się przed przejazdem. Wtedy nadjechał pociąg - opowiada 15-letni Paweł, świadek wypadku. - Ciężarówkę aż podniosło do góry, rozerwało i odrzuciło na kilka metrów. Ksiądz jest wierny swoim wartościom nawołując do tego, by natychmiast ujawnili się duchowni współpracujący z SB?"
342,342,"- Pojechaliśmy wszyscy zebrać słomę - mówi Stefan Kobus (70 l.), mąż Apolonii. - Ja wróciłem wcześniej, zrzuciłem kilka kostek słomy i jak usłyszałem, że krowy ryczą za stodołą, to pomyślałem, że trzeba napoić i boso pobiegłem do nich. Tuż przy studni z wodopojem pan Stefan znalazł porozrzucane klapki, w których chodziła jego żona. Reklamowano ich jako ""zaprzysięgłych wrogów"" i tak też się zachowywali. W walce Floyda Mayweathera juniora z Zabem Judahem o mistrzostwo świata IBF i IBO w wadze półśredniej musiała interweniować... policja. Przez 5 minut bokserzy nie walczyli, bo na ringu trwała bójka sekundantów. Zapraszamy go do konsumowania. Chwyta kiełbaskę i pałaszuje ze smakiem. Po chwili znika w tłumie. Godzina 14.05. Podchodzi do nas dwuosobowy patrol straży miejskiej. Ale nie z powodu dymu z grilla. - Złamał pan przepisy ruchu drogowego - mówi jeden z funkcjonariuszy. - Powinien pan mieć zgodę na zajęcia pasa drogowego. Pouczam pana, że brak takiej zgody może skutkować wystawieniem mandatu. Tymczasem na parking pod pizzerią wjeżdża auto. Kolega Pawła Guzika podrzuca go do zaparkowanego tu ""malucha"". Wtedy bandyci atakują chłopaka. Piotr A. bije go pięścią, a jego kompan Piotr G. kopie w tył głowy. Paweł przewraca się. Bandyci odjeżdżają. Nieprzytomnego Pawła znajduje właściciel pizzerii. Chłopak trafia do szpitala. Mimo pomocy lekarzy umiera. Na tym nie kończą się ich problemy. - Ustalamy, czy lekarze pod wpływem alkoholu wykonywali swoją pracę i czy narazili pacjentów na niebezpieczeństwo - tłumaczy Krzysztof Olszowiak z lubińskiej policji. Jeżeli tak było, grozi im kara do pięciu lat więzienia. - Boimy się bardzo, szczególnie o dzieci. Tych os jest tu od czorta. Wystarczy tylko postawić coś do jedzenia na stole już się zlatują. Całe gromady - mówi Jadwiga Sumiła (62 l.). Pani Jadwiga trzynaście lat temu kupiła w Arciechowie działkę ze starym domostwem. Przyjeżdża z Warszawy na każde wakacje z mężem, dziećmi i czterema małymi wnukami. - Nie wszyscy Polacy zabili mojego syna. Nie musicie czuć się winni i nie chcę nagonki na waszych rodaków w Europie. Zbrodnię popełnili ci dwaj źli chłopcy - powiedział ""Super Expressowi"" Guy van Holsbeeck, ojciec zamordowanego Joego. Jego 17-letni syn zginął 12 kwietnia na dworcu w Brukseli z rąk równolatka z Polski romskiego pochodzenia, Adama G., który wraz z kolegą Mariuszem O. próbował okraść Joego z odtwarzacza MP3. W jednej chwili runęło życie Michała. Był chory na raka pęcherza moczowego. Chciał szybko zarobić pieniądze na operację. Wysłał do Tajlandii paczkę z pastylkami ecstasy. Kiedy pojechał ją odebrać, wpadł. To było ponad dwa lata temu. Dochodzenie, rozprawa i czekanie na wyrok. Tajlandia nie patyczkuje się z takimi jak Michał. Sąd pierwszej instancji skazał go na dożywocie. Katowice. Policjanci jadący nieoznakowanym radiowozem spowodowali wczoraj po południu w Piekarach Śląskich wypadek, w którym zginęła na miejscu starsza kobieta, a jej 14-letnia wnuczka ranna trafiła do szpitala. Ze wstępnych informacji wynika, że policyjny radiowóz wjechał na skrzyżowanie z drogi podporządkowanej. Tam doszło do zderzenia z jadącym drogą z pierwszeństwem przejazdu dostawczym samochodem marki Peugeot, który z kolei najechał na idącą chodnikiem kobietę i jej wnuczkę. Kiedy tylko nadarzyła się okazja - uciekłem stamtąd. Do kraju, rodziny. Ożeniłem się, zdobyłem prawnicze wykształcenie, mam dorosłego syna, wnuka, od lat jestem na emeryturze. A to, co mi się przydarzyło - potraktowałem jak epizod. Przez tyle lat nigdy nikomu się nie przyznałem do tego romansu, dopiero teraz, dla ""Super Expressu"". Największy producent komputerów osobistych, firma Dell, zrezygnowała z budowania swej fabryki w słowackiej Nitrze. W zamian chce inwestować w Polsce, w Łodzi - doniósł słowacki dziennik ""Pravda"". My możemy się tylko cieszyć, w takiej fabryce znalazłoby zatrudnienie ok. 900 osób. Trzy lata temu w Bratysławie Dell otworzył regionalne centrum handlowo-serwisowe, w którym pracuje 1300 osób. Jak wygląda ochrona polskich więzień, skoro bandyta może z nich spokojnie wyjść?"
354,354,"W pewnym stopniu wszyscy się zmieniliśmy. Czas najwyższy, aby Lepper objął władzę. Aby udowodnił, że będą zmiany na korzyść. Poseł w liście do ministra pyta o możliwość postawienia Polańskiego przed polskim sądem. Z odpowiedzi nie będzie raczej zadowolony. - Wprawdzie musimy poczekać na oficjalne stanowisko urzędników ministerstwa, ale w moim odczuciu nie ma możliwości, by pan Polański stanął przed sądem, chociażby dlatego, że zgodnie z polskim Kodeksem Karnym to przestępstwo uległo przedawnieniu - mówi Julita Sobczyk, rzecznik prasowy Prokuratury Krajowej. Lepper wicepremierem?"
