,Unnamed: 0,sentence
5585,5585,"- Nasi urzędnicy przyjrzą się drodze. Największe dziury zostaną załatane - obiecuje H. Włodarczyk. Mieszkańcy Dębinki i Rytwin zastanawiają się, po co im właściwie gmina. Zwłaszcza, że nie wiedzą do końca, do której należą. Gminy Tuplice i Trzebiel położone są od siebie o rzut kamieniem. Raptem cztery kilometry. - To całkowita paranoja - denerwuje się proszący o anonimowość mieszkaniec wsi Rytwiny w gminie Trzebiel. - Jadąc do mojego urzędu gminy mijam urząd w Tuplicach. Czy nie byłoby prościej, gdybyśmy należeli do Tuplic?"
5587,5587,"- Na pytanie Eleonory Szymkowiak Cimoszewicz odpowiedział, że nie wysyłał dzieci do Stanów Zjednoczonych. - Moje dzieci czuły się fizycznie zagrożone w Polsce. Córka w ciągu dwóch tygodni otrzymała dwa tysiące pogróżek, że zostanie zabita - wyjaśnił i dodał, że chciałby mieć dzieci przy sobie, ale one ""podejmują decyzje samodzielnie"". Anna P. jest szefową apteki w Krośnie Odrzańskim. - Nie mam zeszytu, tylko program komputerowy, w którym jest specjalna opcja ""kolejka"" - wyjaśnia. - Pacjentów, którzy są nam coś winni, umieszczamy właśnie w tej opcji. A usuwamy z niej, gdy spłacą dług. Mimo takiego nowoczesnego rozwiązania i tak mam sporo kłopotów. Kierowca z Zielonej Góry: - Chciałbym jeszcze zabrać głos w sprawie tej nieszczęsnej drogi S3. Wydaje mi się, że ci z Warszawy nie mają żadnego interesu na tym obszarze i przez to są takie problemy. Gdyby tylko ogłoszono przetarg na ten teren i ktoś z Warszawy kupiłby go, to droga powstałaby w miesiąc. Dr Roman Monczak podkreślił, że aparaty do mammografii nie mają jednak certyfikatu. A cytologię niektórzy lekarze robią nie wiadomo jak i gdzie. Bez trzymania standardów. Bez etyki. - To do kogo chodzić?"
5668,5668,"Moja książka jest interpretacją akt znalezionych w IPN-ie, a nie moralną przypowieścią. Resztę zostawiam Panu Bogu. Czy dla całego procesu nie byłoby lepiej, gdyby opisać tylko te przypadki, których dokumentacja jest obfita i kompromitująca?"
5676,5676,"Na dzień obecny kontynuuję czytanie biografii Nerona. Ale tak po za tym prawie codziennie wracam tez do Fight Clubu. Moge ta książke cczytac cały czas. Otwieram na danym fragmencie i jazda:) Nigdy sie jescze nie spotkałam z tak błyskotliwym językiem i zawartej w tej ksiazce filozofii bohatera:) Rosiek Barbara Kokaina i wypadałoby Antygonę Sofoklesa. oh jak ja nie lubie lektur. Ekhem To pierwsze ostrzeżenie które dostałam od moderatora xD Jak pisałam posta, to zaczynałam czytać Makbeta, teraz skończyłam i stwierdzam, że wcale nie jest taki zły. Jednak żeby wszystko zrozumieć musiałabym jeszcze conajmniej jeden raz przeczytać Teraz Księżniczka - Andrzej Pilipiuk"
5686,5686,"Beata nigdy nie zobaczyła swojego wydrukowanego Aniołka. Lubiła pisać reportaże o tym, w co ludzie wierzą, jak się modlą i o co, jak myślą i czego pragną. Sporo pisała o hinduizmie, islamie, Trzecim Świecie. Opowiadała także o tych, którzy z Bogiem na ustach zabijają innych. Napisałaby więc z pewnością o Bali, co się stało w Kucie, tuż przy głównym deptaku. Akurat mieszkała (od dwóch dni) w hotelu nieopodal. Niemłoda kobieta, pewnie mieszkanka wsi Aba, rozpoznała Czajkę i pokazała jej ręką, że powinna wejść do środka pałacu. Weszli całą trójką, na początku nieśmiało, powoli, z przekonaniem, że zostali dopuszczeni do królewskiej prywatności, że dostępują wyjątkowego zaszczytu, który ludziom przed bramą nie został podarowany. Ale nie. Na dziedzińcu stał taki sam kolorowy tłum, rozgadany, tutejsi, biali i Japończycy, wszyscy na coś czekali. Czy ma listę wszystkich rannych przyjętych do szpitala?"
5692,5692,"Jedna osoba zmarła, a pięć ciężko zatruło się alkoholem niewiadomego pochodzenia. Do nieszczęsnego zdarzenia doszło w Sowinie koło Jasła. Starsze, około 60-letnie małżeństwo razem ze znajomymi piło w niedzielę i poniedziałek skażony alkohol. Gdy dwaj bracia, w wieku 22 i 24 lat poczuli się źle, wezwano pogotowie, ale zanim dojechała karetka, starszy mężczyzna zmarł."
5778,5778,"Obok towarów z zezwoleniem GIS i atestem Instytutu Matki i Dziecka sprzedaje się artykuły, których etykieta sugeruje, że są przeznaczone dla małego dziecka, a nie przeszły procedury uzyskania atestu - mówiono na konferencji prasowej w Instytucie Matki i Dziecka. Według naukowców z tej placówki, nie jest obojętne to co małe dziecko je. W ciągu pierwszego roku życia niemowlę potraja swoją wagę urodzeniową."
5834,5834,"Słuchaj, to wspaniała kobieta, przekonywał Szczesiak, jak byśmy sami o tym nie wiedzieli. Dlatego ze zdumienia otwieraliśmy szeroko oczy. Że też takie rzeczy musi nam tłumaczyć redaktor z Gdańska. Szczesiak jest wielkim redaktorem, z wielkiego miasta, stolicy wielkiego województwa, które będzie niebawem stolicą jeszcze większego księstwa nadmorskiego. Dlatego nie musi znać wszystkich lokalnych niuansów. Wybaczamy mu. Współczesne, młode i średnie pokolenie prawie już nie zna języka kaszubskiego. W przeciwieństwie do starszych, którzy wypowiadają się w pięknej kaszubszczyźnie, z naleciałościami angielskimi i polskimi. Z polszczyzną stykają się, gdy Polonusi z Toronto, Montrealu, Ottawy i Kingston przybywają nad jeziora na Wyżynie Madawaski. Zawarte na wideokasecie wypowiedzi mogą być interesującym materiałem dla językoznawców z Uniwersytetu Gdańskiego. W czasie uroczystego otwarcia szkoły nadano jej imię Aleksandra Labudy, działacza kaszubskiego. Szkołę poświęcił biskup  Piotr Krupa , a w uroczystości wzięli udział wiceminister edukacji  Wojciech Książek , wicewojewoda gdański  Krzysztof Pusz , księża, nauczyciele, strażacy i miejscowa ludność. Szkoła ma dwie kondygnacje, 9 izb lekcyjnych, kuchnię i kotłownię. Tegoroczne zbiory rzepaku będą najwyższe od 3 lat. Również niezłe dochody uzyskają plantatorzy czarnej porzeczki. Zboża mniej się opłacają. Zatem rolnicy w Polsce, nie w ciemię bici, sieją rzepak. W tym roku to wyjątkowo dobre trafienie, bowiem wzrasta popyt na margaryny i oleje. Wynika to ze zmiany stylu żywienia. Polacy przestali jeść masło. W sobotę, 11 lipca, wdarliśmy się na weselisko w remizie strażackiej w Lipuszu. Jak się okazało tego dnia ślub zawarli  Aneta Rolbiecka  i Dariusz Pepliński, oboje z Lipusza. Aneta pochodzi z domu byłych gospodarzy. Ma starszą siostrę Alicję i dwóch braci - Ryszarda i Zdzisława. Z Lipusza trasa powiedzie ich dalej do Sulęczyna, Sierakowic, Mirachowa i Otomina. Do zdjęcia pozowała nam kolejarska grupa piechurów ze Szczecina, z koła PTTK nr 8, o wdzięcznej, kolejarskiej nazwie ""Sygnał zastępczy"". Obchodzono właśnie urodziny Marcina Webera, którego widzimy na zdjęciu z ciocią Katarzyną Weber. Informacji udzielała nam Janina Marcinkowska, która już po raz piąty wybrała się na pieszą wyprawę, z mężem Andrzejem i synem Piotrem. W czerwcu zgłoszono 262 oferty pracy, z tego 56 to oferty robót publicznych i dla absolwentów. Na koniec czerwca aktywnymi formami przeciwdziałania bezrobociu finansowanymi z Funduszu Pracy objęto 324 osoby, z tego 5 osób przyucza się do zawodu lub zmienia kwalifikacje, 1 absolwent odbywa staż, 158 absolwentów zatrudniono, 81 osób zatrudniono przy pracach interwencyjnych, 64 osoby - przy robotach publicznych, 15 osób w ramach programu specjalnego. Na wideokasecie można zauważyć nieliczne z zachowanych farm, gdzie wypasa się jeszcze konie, krowy i owce a przy domu kręci się ptactwo. Obok stoją traktory, kosiarki i po kilka samochodów przy domach. W lasach stosuje się pełną mechanizację. Wielu młodych opuściło te tereny, szukając pracy i wykształcenia w okolicznych miastach."
5855,5855,"W tym momencie nadarza się okazja, żeby wyrazić pani domu uznanie za przyjęcie. Jeżeli jego uczestnicy opuszczają gościnny dom z uczuciem pewnego żalu, że skończyło się miłe zebranie, to znak, że przyjęcie się udało i że wszyscy będą je mile wspominać. To najwyższa nagroda dla gospodarzy. Jest to nakrycie do lunchu. Po zdjęciu serwetki i położeniu jej na kolanach na małym talerzyku spożyjemy przekąskę. Sądząc po sztućcach, może nią być danie rybne. Na dużym talerzu będzie danie główne, a na talerzyku na lewo — pieczywo. Na prawo — kieliszek do wina i szklanka do wody mineralnej. Widelczyk leżący nad talerzami jest widelczykiem deserowym. Deser zostanie podany po sprzątnięciu talerza głównego. Na początku były palce. Nasz praprzodek posługiwał się nimi, jeszcze zanim zasiadł do pierwszego ""stołu"". Był to w jego przekonaniu najwygodniejszy sposób jedzenia, nie miał zresztą pojęcia o żadnych sztućcach, nic więc dziwnego, że palce uważał za jedyne i najlepsze. Z mebli znajdujących się w naszych mieszkaniach jedynie stół może sobie rościć prawo do współtworzenia kultury towarzyskiej. Zauważyli to wszyscy autorzy książek pełniących rolę przewodników po dobrych obyczajach. Sposób zachowania się przy stole zawsze określał poziom cywilizacyjny i ciągle jeszcze stanowi probierz kultury towarzyskiej oraz towarzyskiego obycia. Usłyszałem w odpowiedzi, że mówi przecież o rozmowie przy dobrze zastawionym stole, a poza tym spotkanie się obydwu sztuk — bo rozmowa także do sztuk należy — na jednym przyjęciu jest ideałem rzadko jedynie osiągalnym, lecz gdy to się stanie, wtedy doskonała kuchnia rozgrzewa temperamenty, inspiruje umysły, rozwiązuje języki, a co najważniejsze — pobudza do aktywności nawet leniwe intelekty. Szczególnie świąteczny wygląd powinien mieć stół weselny. Przy jego dekoracji można sobie pozwolić na nieco fantazji i np. ubrać go kwiatami w kształcie girland przypiętych do obrusa, wstążkami, a przy każdym nakryciu położyć maleńkie bukieciki kwiatów. Na środku stołu, który zazwyczaj jest dość długi, kładzie się płytę lustrzaną, a na niej wazę z kwiatami. Urodę stołu znakomicie podniosą antyczne lichtarze ze świecami, kryształy i srebra. Na początku naszych dziejów wspomina się o dwóch ucztach: jednej skromnej — czym chata bogata — a drugiej wspaniałej. Piast i Rzepicha podejmowali swoich gości z okazji postrzyżyn syna Ziemowita oraz Bolesław Chrobry wydawał wielką ucztę na cześć cesarza Ottona III. Parówki gotowane we wrzątku i podawane wprost z rondla bierze się na talerz i usuwa błonę, w której były gotowane. Nie robi się tego palcami. Parówkę można jeść ze skórką, jeżeli jest odpowiednio cienka, lub też krajać na kawałki i po kolei zdejmować skórkę, można wreszcie przekrajać parówkę na połowę i oddzielić mięso od skórki. Skórkę zostawia się na talerzu. Ciekawej rozmowy przy dobrze zastawionym stole nic zastąpić nie może — oświadczył mi kiedyś bywalec wielu znakomitych przyjęć i niekwestionowany autorytet w sprawach savoir-vivre’u. Znałem go jako wielkiego i wybrednego smakosza, żywiłem więc niejakie wątpliwości co do absolutnej szczerości jego słów, odezwałem się więc nieco przekornie, że przecież sztuka kulinarna renomowanych mistrzów może stanowić poważną konkurencję dla najbłyskotliwszej rozmowy. Czy do wszystkich potraw używa się sztućców?"
5864,5864,"W części trzeciej omówimy bardziej szczegółowo wkład stanów wejściowych do amplitudy i przekroju czynnego elastycznego rozpraszania neutronów na jądrach średnich i ciężkich, tych, które z dobrym przybliżeniem można uważać za jądra sferyczne. W zakończeniu tej części podane będą wyniki numeryczne uzyskane dla niektórych jąder omawianego obszaru. Częściej funkcje C lambda  określa się eksperymentalnie dla kilku wyselekcjonowanych przypadków i to następnie ekstrapoluje się na inne przypadki. Elementy macierzowe przejść (E2) są łatwe do określenia dla niskoleżących stanów, to samo w niektórych przypadkach dla przejść (E3).(s.123) Wyższe multipolowości przejść są najlepiej obserwowane dla lekkich cząstek, ponieważ ciężkie cząstki dają duży przekrój czynny na wzbudzenie wielokrotne stanów jądrowych. Fenomenologiczna teoria wzbudzeń oscylacyjnych jądra oparta jest na założeniu, że wzbudzenia te polegają na zmianie kształtu jądra. Jeśli beta  lambda  oznacza parametr deformacji jądra, to hamiltonianem wyjściowym jest  , (1.1) gdzie C lambda , B lambda  oznaczają odpowiednio parametry sztywności i bezwładności jądra odpowiadające drganiom o multipolowości lambda. Częstość drgań oblicza się z klasycznego wzoru .(1.2) 2. Przerwa energetyczna delta jest malejącą funkcją I. 3. Energia potencjalna w funkcji beta dla różnych I wykazuje minima   I nieznacznie wzrastające w funkcji I. A więc efekt CS jest bardzo słaby i stanowi jedynie małą część przyczyny wzrostu J wraz z I. 4. Otrzymuje się zadowalające wyjaśnienie wzrostu momentu bezwładności J wraz z energią w paśmie rotacyjnym (głównie za sprawą efektu CAP). 4. Płynna regulacja energii w zakresie 0,1 E max  — E max . 5. Możliwość przyspieszania cząstek w szerokim zakresie mas: p, d, He  U. 6. Dobre parametry wiązki jonów, jak: ogniskowanie, mała rozbieżność wiązki i duża gęstość prądu na jednostkę powierzchni (parametry te wpływają na końcową zdolność rozdzielczą). 7. Dobry stosunek ""efekt / tło"", małe tło promieniowania szkodliwego. Punktem wyjścia dla naszych rozważań będzie jądro przedstawione jako układ wielu nukleonów poruszających się w średnim polu jądrowym określonym przez jednocząstkowy potencjał i oddziaływających ponadto siłami krótkiego i długiego zasięgu. Dla sił krótkiego zasięgu przyjmuje się zazwyczaj przybliżenie przez siły kojarzące nukleony w pary, siły ""pairing"". Siły długiego zasięgu stanowią nieco zmodyfikowany człon rzędu lambda rozwinięcia potencjału nukleon—nukleon w szereg wielomianów Legendre’a""   (1.3)."
5868,5868,"Jakże przepięknie wygląda, gdy siedząc wysoko na gałęzi sosnowej, z rozpostartym w wachlarz ogonem, z przymkniętymi oczyma, wygłasza cudowną pieśń miłośną; a gdy ją skończy, zaczyna drugą, trzecią... dziesiątą, każdą następną coraz piękniejszą, coraz gorętszą. Naraz się zatrzymuje, wyciąga długą szyję, ubarwioną szmaragdowo-seledynowymi piórami; rozgląda się, nasłuchuje, jakie pieśń jego zrobiła wrażenie"". W pewnym oddaleniu od dworu, ale na tyle blisko, by można było tam w każdej chwili zajrzeć, znajdowały się zabudowania gospodarcze, czyli stajnie, owczarnie, obory, chlewy i kurniki, dalej pomieszczenia do przechowywania plonów i inne przeznaczone na maszyny rolnicze, warsztaty, mieszkania pracowników i wozownie. Najbardziej interesują nas te ostatnie, jako że były najbliżej związane z życiem codziennym. Tak było, kiedy panienka uczyła się w domu, ale istniały przecież także pensje dla dziewcząt. Często były to szkoły prowadzone przez zakonnice, ale zdarzały się i takie, jak pensja pani Latter z Emancypantek. Niejednokrotnie wiedza stamtąd wyniesiona była bardziej usystematyzowana niż ta zdobyta w domu. Ponadto, jeśli w wyniku różnych nieszczęść kobieta traciła majątek i materialne podstawy bytu, to świadectwo ukończenia jakiejś szkoły umożliwiało jej podjęcie pracy nauczycielki domowej. Choinka bardzo szybko zadomowiła się we wszystkich dworach i tak jak dziś stanowiła dla dzieci największą atrakcję bożonarodzeniowych świąt. W tajemnicy stroili ją dorośli, by w odpowiednim momencie objawić ją dzieciom już ubraną i z zapalonymi świeczkami. Była dodatkowym prezentem, jednocześnie zachwycała i oszałamiała oraz stwarzała niezapomnianą, magiczną atmosferę świąt. Nic dziwnego, że została natychmiast pokochana i uznana za nasz własny, słowiański, prastary obyczaj."
5869,5869,"Zawahał się, jakby chciał coś dodać. - Eee... w razie czego wie pan, gdzie mnie szukać - odwrócił się, nie podając Wilkowi ręki i odszedł w kierunku wind. Wilk odprowadzał go wzrokiem, aż ciemna sylwetka rozpłynęła się w mroku korytarza. - Nie pasuje?"
5947,5947,"Oprócz pipet o stałej pojemności są w użyciu pipety skalowane (rys. 13b) Są to rurki szklane cylindryczne o zwężonym końcu. Podobnie jak biureta, pipeta taka podzielona jest na całej swej długości na dziesiętne części mililitra. Przed nabraniem roztworu do pipety należy ją przepłukać niewielką ilością tego roztworu, ponieważ woda pozostała na ściankach po myciu rozcieńczyłaby roztwór mianowany."
5999,5999,"Eseje powstały w różnych momentach, są różnych rozmiarów, nie zostały zbudowane według tego samego schematu. Praca nad każdym trwała stosunkowo długo. Kiedy przystępowałem do redakcji tekstu, zawsze dysponowałem taką ilością materiałów, iż mogłyby stanowić podstawę do napisania książki. Zawsze jednak brakowało czasu na skonstruowanie czegoś obszerniejszego i trzeba było ograniczyć się do zwięzłego eseju. Każdy z nich jest odrębną całością. Razem stanowią rodzaj historii decydującego etapu integracji europejskiej. Plan Monneta został przedłożony Schumanowi 28 kwietnia 1950 roku. Po zapoznaniu się z tekstem minister uznał, że wymaga on jeszcze pewnych zmian i retuszy. Jego współpracownicy przystąpili więc ze współpracownikami Monneta do rewizji tekstu, która zajęła im kilka następnych dni. Każde słowo było starannie ważone. Wersja, która w maju dotarła ostatecznie do wiadomości rządów i opinii publicznej, była dziewiątą z kolei. Podobnie jak inne książki Ryszarda Coudenhove-Kalergi Pan-Europa przedstawia problemy polityczne w perspektywie tendencji i rytmów historii, a problemy Europy na tle procesów ogarniających całą ludzkość. Inspiracja i historyczne znaczenie tej książki pozwalają wybaczyć autorowi jedną czy drugą - pewnie wynikającą z pośpiechu - niezręczność ekspresji, jedno czy drugie zatarcie różnicy między życzeniami a rzeczywistością. Tajne rozmowy na temat pokoju kompromisowego spełzły jednak na niczym. Wojna miała trwać do listopada 1918 roku i pochłonąć dalsze miliony istnień ludzkich. Monarchia Habsburgów została rozczłonkowana. Briand do końca życia nie przestał jednak myśleć o jej odbudowaniu pod postacią federacji państw naddunajskich. Obawiał się, że rozdrobnienie polityczne Europy wschodniej i południowo-wschodniej doprowadzi wcześniej czy później do opanowania jej przez imperializm niemiecki albo rosyjski. W Luksemburgu, siedzibie władz EWWS, Monnet steruje działalnością stosunkowo niewielkiej administracji europejskiej, której kwalifikacje, entuzjazm, rytm pracy i zdolność innowacji przeszły do legendy i stały się wzorem do naśladowania dla administracji europejskich powstałych później. Jest szefem ekipy wyjątkowo wymagającym. Troszczy się nie tylko o ogólny kierunek prac, ale również o drugorzędne na pozór szczegóły. Powtarza, że suma tych ostatnich tworzy obraz całości."
6013,6013,"Przyjechało wielu ciekawskich, ale też kupujących. Jeśli komuś zabrakło pieniędzy, mógł zapłacić za towar kartą płatniczą lub po prostu wypłacić pieniądze z bankomatu. Jedyny tutaj elektroniczny kasjer nie akceptuje jednak wielu kart bankomatowych... - W naszym hipermarkecie funkcjonuje jeden bankomat PKO BP - poinformowała ""Głos"" Anita Gdula, asystentka dyrektora z Auchan Gdańsk."
6073,6073,– panie Jarosławie. ostatnie słowo – jeszcze jedna istotna rzecz że ten materiał. związany z kulturą nowoczesną kulturą. tworzoną przez Żydów tutaj w Polsce. – tak. tak no. w okresie międzywojennym w takiej. skrajnie narodowej publicystyce funkcjonowała taka zbitka że awangarda to bolszewizm i żydokomuna. tak że bardzo mocno były utrwalone takie wyobrażenia o tej. o całej awangardzie niezależnie od tego kto. jak tworzył że jest wytworem owych kosmopolitycznych Żydów którzy właśnie w ten sposób. próbują zniszczyć nasze narodowe. lokalne polskie. wartości – bo też myślę że jeszcze jeden taki paradoks o którym warto wspomnieć to to że stereotyp który teraz powielamy często. tego Żyda z pejsami to jest trochę tak naprawdę właśnie stereotyp propagandy nazistowskiej na przykład tak ?
6114,6114,"Ankieta przeprowadzona przez sieć telewizyjną Fox zapowiada, że książka Moniki Lewinsky o jej stosunkach seksualnych z prezydentem Billem Clintonem (w marcu pojawi się na rynku) prawie zupełnie nie interesuje Amerykanów. Mało kto w USA ma ochotę czytać zwierzenia byłej stypendystki Białego Domu, które przez przeszło rok Amerykanie mieli na co dzień w telewizji i prasie."
6193,6193,"], ja otworzę przed Tobą wszelkie tajemnice Ziemi. 2. Ale ja poprowadziłem go na bardzo wysoką górę i pokazałem mu wszystkie krainy Ziemi. I ujrzeliśmy, jak lew rozdziera antylopę; jak wąż dławi małe pisklęta; jak sowa, upiór nocy, szybuje bezgłośnie nad myszą, a ta nie ma się gdzie schronić; jak mucha oblepiona pajęczyną czuje drżenie sieci pod łapami nadchodzącego pająka. Pierwsze prawdziwe zdanie tego listu. Podniósł wzrok na stertę czasopism, poukładanych porządnie tego ranka. Prędzej czy później można było liczyć, że Anita przyjmie jego zaproszenie. Należałoby wcześniej umyć okna. Ale jeśli to będzie po zmroku, wystarczy zaciągnąć zasłonki. Krzysztof postanowił dorzucić do maila trochę autentyzmu. Odrobinę więcej. 6. Jak odpłacimy się za te bezmierne dobrodziejstwa?"
6195,6195,"7. Ta kobieta jednego dnia straciła męża i dowiedziała się o śmiertelnej chorobie swej córki. Tamta urodziła dziecko z wielkim okiem pośrodku czoła. Żyją, tak, żyją dalej. Radujmy się z nimi, bo żyją!"
6222,6222,"- przerwał buldogowaty. - Co pan tu pieprzy. - Dżiokonda. - A powiedział po francusku: - Oto utalentowana nadzieja naszej literatury. Poeta splunął. Lubow uśmiechnęła się, Pola zatrzepotała rzęsami i powiedziała: - Chodźmy się przejść, pokazać jej, bo to przecież zima nasza, mroźna, biała. - To pijak - powiedziałem. - Niedawno napoczął moją melbę. Ma skłonności homoseksualne. - Najgorsze jest to, że oni są wszyscy bezkarni. - Różowiutki sędzia uderzył pięścią w stół. - Nie boją się. - Ani rozpustnicy, ani cudzołożnicy, ani rozwiąźli, ani mężczyźni współżyjący z mężczyznami nie wejdą do królestwa Bożego - zabeczała ponura twarz. - Świetny pomysł - ucieszył się Niedźwiednik. - Prosimy, prosimy - rozległy się wokół głosy i śmieszki. - Co ty na to, Himilsbach, masz ochotę pomuzykować?"
6243,6243,"Marta w powieści Orzeszkowej zjawia się w szwalni dopiero wtedy, gdy po śmierci męża zawiodły wszystkie inne sposoby zdobycia środków do życia. Literatura pozytywistyczna stworzyła wzorzec bohatera — inżyniera bądź przedsiębiorcy, jak Borowiecki z Ziemi obiecanej Reymonta — któremu szło o szybkie dorobienie się dzięki menedżerskiej pracy umysłowej, choć w razie potrzeby umiał zakasać rękawy na przykład przy budowie własnej fabryki."
