,Unnamed: 0,sentence
3225,3225,"Trudno się dziwić, że w obliczu coraz to nowych chorób XXI wieku społeczeństwo bardzo wnikliwie patrzy na sprawy związane z bakteriami, wirusami i nie chce się godzić na byle jakie rozwiązania, których zastosowanie może zagrażać ich zdrowiu. Zapytałem p.o. dyr. OSiR Tomasza Pułkownika, czy basen jest gotów na przyjęcie ludzi, czy jest właściwie przygotowany do sezonu letniego . W nocy 25 lipca na terenie jednego z lokali w Ostrzeszowie, nieznany sprawca skradł telefon komórkowy. Straty na szkodę mieszkańca Ostrzeszowa. W solarium na terenie Ostrzeszowa nieznany sprawca dokonał kradzieży pieniędzy w kwocie 920zł na szkodę jednej z klientek. Na terenie lokalu Brzózki nieznani sprawcy w nocy z 27 na 28 lipca dokonali kradzieży dwóch parasoli ogrodowych. Wartość strat ok. 1200zł. Sygnałem do rozpoczęcia obchodów stało się głośne wycie syren kilku samochodów strażackich. Zebranych powitał burmistrz Bogdan Małecki, on też wygłosił okolicznościowe przemówienie. Mówił w nim o przełomowym znaczeniu Konstytucji 3 maja, ale nie tylko. ""Obyśmy osiągnęli w naszym narodzie taką spójność, taką solidarność, oby nas było zawsze więcej, kiedy są tak ważne uroczystości"". Właśnie tak - szybko, nagle, nieoczekiwanie odszedł JERZY MAKLES. Przed tygodniem rzesze ostrzeszowian odprowadziły go na miejsce wiecznego spoczynku. Zanim wiązanki kwiatów przykryły mogiłę, słowa modlitwy prowadzonej przez ks. Pawła Dorucha splatały się z wyrazami bólu i wspomnieniami przyjaciół. Pierwszy z nich hm. W. Mucha-Kruczyński wspomniał harcerską drogę dh. ""Sowy"", jego 18-letnie komenderowanie hufcowi Szarych Szeregów i wiele harcerskich inicjatyw. Rafał Czarnecki (ur. 1979) - perkusista wszechstronny, grający z muzykami wykonującymi takie style jak funk, rock, pop, jazz, blues, folk. Wcześniej grywał m.in. z zespołami Raven, Zgis, Mr. Blues. Obecnie oprócz współpracy z Fool-X, gra w zespole Andrzeja Cierniewskiego i w Cockroach Quartet oraz czasami jako zastępca w zespołach Redlin i Patchwork. - Nie mam pojęcia. My się tylko cieszymy, że to dalej tak funkcjonuje. Ja mogę jedynie powiedzieć, gdzie ta siła tkwiła za czasów Ryśka. Myślę, że są to po prostu dobre kompozycje i świetne teksty. - Kiedy wszyscy spragnieni nowej płyty fani wreszcie zostaną zaspokojeni?"
3422,3422,"Przychodzimy jako spadkobiercy Krzywoustego drużyny. Ona poprzez lasy przerąbała pierwszą drogę dla cichego apostolstwa synów bożych. Ona szła wielkie rzesze słowiańskie wesprzeć o polskie mocarstwo, obronić i zachować. My przychodzimy, gdy już rzesze słowiańskie pochłonięte zostały i zniszczone na wieki. Przychodzimy, aby szczątek ostatni od zagłady uchronić. Lecz brzmi wśród nas ta sama, nowotna po wsze czasy, cantilena radosna. Na lewym brzegu Wisły, niżej Chełmna, Świecie jako miejsce swego wypadku obwałował. Lecz nowe poniósłszy porażki, po wielokroć doznawszy klęsk wojennych, niestrudzony wojownik znowu prosił o pokój. Opizzoni, opat Messyny, legat papieski, zdjął zeń klątwę, gdy skruszony pokutnik zerwał wszelkie z poganami stosunki i obiecał pomagać Krzyżakom w dziele wytępienia bałwochwalców. Spustoszył potem Kujawy i zabrał wielkie łupy, które jednak mistrz prowincji mu wydarł. Po zawarciu nowego pokoju w połowie trzynastego stulecia Swiętopełk nową, piątą z rzędu wojnę rozpoczął. W ciągu dwunastu lat blisko, czasu władania wielkiego mistrza Zakonu Henryka von Hohenlohe, Swiętopełk pomorski wiódł nieustanną, bezsenną i straszliwą walkę z Zakonem. Potem mknie wzdłuż międzymorza, zostawiając na jego południowych wybrzeżach grube złoża na poły zmielonych kamieni, muły znacznie od zachodnich tłuściejsze, piaski nie tak sypkie i większą niż z pełnego morza wodorostów obfitość. Ta masa wodna, nieraz podnosząca poziom Wiku o jeden metr ponad równię Puckiej Zatoki, spotyka się przy dziobie gołębia z silnym prądem zachodnim. Łuk nagięty jego dłonią bolesną miotał upierzone strzały w piękne białe piersi morskiej mewy. Zabijał czajki, rybitwy, nury, burzyki, kormorany, kuligi i perkozy - strącał z niebios dzikie gęsi, kaczki i piękne kiełpie, wolne łabędzie, gdy w południowe krainy z krain północy leciały. Kamienny młot człowieka uderzał w furii we włochatą pierś zwierzęcą. Lecz wnet radość powszechna w straszne przemieniła się czucie, gdy wśród wielkich łososi, skaczących w górę po piasku, ujrzeli nieruchomego Litaka. Kałem morskim zwalany a oblepiony kidzeną, z raną krwawą na czole, leżał z rozkrzyżowanymi rękami. Przyszedł oto nierychło na wołanie Józefa. Z głębin morza dalekich a z bełku przepadłego powrócił, żeby u stopy braterskiej jasne czoło położyć. O niespodzianej godzinie."
3505,3505,"Chce ich promować np. sam mistrz Laurent, który ma jeden ze swoich salonów także w Lublinie. Już po raz drugi odbędzie się więc w Lublinie Otwarty Konkurs Fryzjerski dla młodych fryzjerów (do lat 30) i uczniów mających za sobą przynajmniej 3 lata nauki zawodu."
3571,3571,"Wtóruje mu Józef Birka, prawnik Polsatu, szef rady nadzorczej spółki: - Dziś TVP przejmuje 70 proc. budżetów reklamowych. Mając podwójne finansowanie i stosując obniżki cen, może stać się monopolistą na rynku reklam. Trzy programy ogólnokrajowe telewizji publicznej są w stanie całkowicie zaspokoić potrzeby rynku na usługi reklamowe - twierdzi mecenas Birka. Taka postać może się już nie narodzić: najmłodszy poseł, autor prawdziwych bestsellerów, zarazem wiceszef rządzącej partii, mąż naprawdę światowej żony, lecz szukający podejrzanych ladacznic na ulicy, lord i milioner, wtrącony do prawdziwego więzienia, gdzie nie mógł nosić nawet porządnej koszuli. Niezatapialny Jeffrey Archer wyszedł właśnie na wolność i musi wymyślić coś nowego: partia go już nie chce. Gomperts: - Dane są jednoznaczne: aborcją kończy się 20 proc. ciąż w każdym kraju. To jest zawsze trudna decyzja dla kobiety. Ale jeśli zostaje podjęta, to znaczy, że jest słuszna. Robiąc specjalizację z aborcji na studiach odkryłam, jak bardzo moje podejście lekarza kobiety, przyjazne i bez osądzania, może w takim momencie pomóc. A ja chcę pomagać kobietom. Duszy nie ma, ale Kotliński nienawidzi Kościoła z całej duszy. Po święceniach doznał, jak się zdaje, katuszy. Napomyka aluzyjnie, że jako młody, przystojny wikary był maglowany przez proboszcza, który chciał się z nim kotłować na łóżku. I Kotliński, jak kiedyś przykładał się do służby Bożej, tak teraz dokłada Kościołowi, jak może. Martens znany jest na świecie jako mistrz brydża sportowego, w Polsce - jako były felietonista ""Gazety Wyborczej"", w regionie - jako były sympatyk Unii Wolności, łebski strateg i współtwórca wyborczego sukcesu SLD. Ale również jako wierny żołnierz Wiesława Ciesielskiego, lokalnego barona SLD, który obejmując posadę wiceministra finansów w rządzie Millera przekazał schedę w pewne ręce. - Nie ma innej recepty. Spójna władza pozwala bez przeszkód porządkować otoczenie - wyjaśnia Martens. Otwartym jest oczywiście pytanie, czy zmiany w rządzie odwrócą uwagę od toczącej się niby śnieżna kula afery Rywina i - podobnie jak zmiany personalne sprzed kilku miesięcy - poprawią notowania premiera w sondażach opinii. Jeśli nie, to w odwodzie zostają jeszcze mało popularni ministrowie: edukacji Krystyna Łybacka i zdrowia Mariusz Łapiński. W czasach elektronicznych rozmyła się wartość mozolnie zapisywanych karteczek i pedantycznie prowadzonych kartotek. Komputer przejął funkcje sekretarki, a czasami także ghost writera, czyli tego anonimowego autora cudzych przemówień, którym posługują się nagminnie politycy i ludzie biznesu, ci, którym przystoi bezustannie przemawiać przed publicznością niezależnie od tego, czy mają coś do powiedzenia czy nie. Swoboda przepływu usług oznacza, że we wszystkich krajach członkowskich bez ograniczeń można świadczyć usługi oraz kupować je i sprzedawać na bardzo podobnych zasadach. Dotyczy to na przykład usług telekomunikacyjnych, transportowych, ubezpieczeniowych, finansowych. Swoboda w tej dziedzinie umożliwia zakładanie spółek, prowadzenie przedsiębiorstw, uprawianie wolnych zawodów. Przyjaciele mówią, że towarzysko jest miły, ale bywa bardzo złośliwy. Ostatnio, podczas spotkania promującego ""Leksykon wątków miłosnych w literaturze"", pewna pani wypowiadała się długo i zawile. Na koniec kokieteryjnie usprawiedliwiła się, że mówi bez ładu i składu, bo jest już w zaawansowanym wieku. Kopaliński skwapliwie przytaknął. A Jacek daje Arkowi fotografię z dedykacją: ""Uwierz mi, a wtedy nasze chwile będą wieczne. Stań się dla mnie taką chwilą"". Byli w wielu innych związkach, które się jednak rozsypały. Wierzą, że tym razem się uda. Arek jest w głębi serca monogamistą. Zawsze chciał stałego związku. Jacek też. Nie interesuje ich seks bez uczucia. Zaskoczył mnie specyficznym doborem faktów w swym felietonie [""Wątpliwości teologiczne"", POLITYKA 6] mistrz Zanussi. Przejawem swobody myśli - jak sądzę - było stwierdzenie, że znaleziono kawałek kamienia mogilnego (zauważmy: kawałek, nie kamień) z inskrypcją poświęconą komuś, kto miałby być (zauważmy: nie mógłby być, ale miałby być) bratem Jezusa, co może stać się kłopotliwym odkryciem dla Kościoła, bowiem podważa dogmat o dziewictwie Marii. Gdy po drodze na Węgry srebrny Mercedes Vito traci orientację i zaczyna błądzić po Słowacji jak bokser trafiony nagłym sierpem, ekipa wzdycha, bo może to zły znak, pierwsze ostrzeżenie, że lekko nie będzie. Chociaż może to jednak dobry znak, zapowiedź jeszcze nie triumfu, ale chociaż drobnego sukcesu, którego polski kobiecy boks nie ma, ale bardzo chciałby mieć."
3722,3722,"Sala konferencyjna, w której odbywają się posiedzenia Rady Miejskiej w Mińsku Mazowieckim, jest własnością Urzędu Rejonowego. Na czas remontu zdjęto ze ścian godło, krzyż i święte obrazki. Po zakończeniu prac zapomniano o ponownym ich umieszczeniu. Trwało to kilka miesięcy. Sprawę braku ""insygniów"" zasygnalizował w interpelacji jeden z radnych. Burmistrz, Zbigniew Grzesiak, wyjaśnił, że są trudności w porozumieniu się z Urzędem Rejonowym. Mieszkaniec Siedlec, wracając do domu, spotkał przy sklepie monopolowym trzech nieznajomych mężczyzn. Po krótkiej rozmowie i zakupieniu butelki wina czwórka mężczyzn udała się na pobliskie podwórko, aby opróżnić butelkę. Gdy po wypiciu trunku siedlczanin chciał opuścić towarzystwo, został prawdopodobnie uderzony w głowę i stracił przytomność. Ocknął się dopiero w szpitalu. Lekarze stwierdzili rozległe złamanie czaszki. Na stanowisku ministerialnym zgodnie z zasadą ,,koszula bliższa ciału"", poseł i wiceminister resortu łączności, M. Sawicki nie zapomniał o potrzebach telefonizacyjnych swojej gminy. Przeprowadzana sukcesywnie od 1996 roku telefonizacja została już zakończona w pierwszym etapie. W dziesięciu wsiach przybyło 424 nowych abonentów. - Tegoroczny plan inwestycyjny zakłada realizację drugiego etapu telefonizacji - wyjaśnia wójt K. Bohowicz. - Impreza ta ma na celu propagowanie strzelectwa sportowego w naszym środowisku oraz jak największe wykorzystanie obiektów do tego przeznaczonych. Z różnych względów obiekty te często stoją bezużytecznie, niszczeją, a przecież tak niewiele trzeba, ażeby temu zapobiec - powiedział prezes Zarządu Rejonowego LOK w Węgrowie, Leszek Knap. - Chcemy również upowszechnić ten rodzaj sportu wśród osób niepełnosprawnych. Stąd też wziął się pomysł zorganizowania strzelnicy sportowej w Łukowie. W części Pałacu od strony parku powstaną apartamenty gościnne z trzema sypialniami, pokojem stołowym i dużą łazienką. Obok znajdzie się część gastronomiczna z kawiarnią. Skrzydło Pałacu od strony ulicy Piłsudskiego zostanie zajęte przez Pałac Ślubów - z salą ślubów o powierzchni stu metrów i nieco skromniejszą salą toastów. W tym samym miejscu będzie także Urząd Stanu Cywilnego. Kochani!"
3753,3753,"Jak się dowiedzieliśmy, nie ma obowiązku rozpisywania konkursu na radę, a burmistrz miasta obligatoryjnie powołuje organ do życia, co też uczynił. Jak uzasadnia wybór?"
3754,3754,"Szczególnie, osoba szefa zarządu Portu Lotniczego budzi kontrowersje. Uważam, że doświadczenie osób, które są spoza “malborskiego podwórka” jest bardzo przydatne – twierdzi Andrzej Rychłowski, burmistrz Malborka. - Pan Machczyński ma bardzo duże doświadczenie i tego zamierzamy skorzystać – przekonuje włodarz. Do dnia zamknięcia tego wydania naszej gazety nie podjęto decyzji o rozstrzygnięciu przetargu na korzyść McDonald's Polska, ale skoro wpłynęła tylko jedna oferta... Zgodnie z wymogami, za 0,4 ha gruntu, sieć fast-foodów będzie płacić co miesiąc ponad 10,5 tys. zł za dzierżawę. Ma wybudować ogólnodostępne parkingi, drogę dojazdową i nasadzić zieleń w otoczeniu restauracji. Inwestor będzie również partycypował w kosztach budowy drugiego malborskiego ronda na skrzyzowaniu ulic Piastowskiej i Parkowej. MALBORK. Do schroniska dla bezdomnych zwierząt w Starogardzie Gdańskim trafiły dary od malborskich dzieci: karma, koce, kołdry, miski, smycze, obroże oraz zabawki. Akcję zorganizowało niedawno powołane Malborskie Stowarzyszenie Przyjaciół Zwierząt “Reks”. Jeszcze przed świętami, do podopiecznych starogardzkiego schroniska trafiło 30 kg suchej karmy, 40 kocy, kołdry, kojce z gąbki oraz puszki z jedzeniem dla zwierząt. – Turysta jest mile widziany, ale my tez coś z miasta chcemy mieć – odzywały się głosy z sali. Z zacietrzewieniem komentowano poczynania władz poprzednich kadencji, które na planach się skończyły. Padło też dużo gorzkich słów pod adresem obecnego burmistrza. MALBORK. Władze miasta chcą pozbyć się kłopotu – szukają inwestora, który chciałby kupić Miejski Zakład Komunikacji. Jeżeli nie będzie chętnych miasto będzie musiało dofinansować zakład Miasto robi drugi krok zmierzający do prywatyzacji Miejskiego Zakładu Komunikacji. Od poniedziałku, potencjalni inwestorzy mogą pobierać materiały informacyjne o sytuacji prawnej i ekonomiczno-finansowej spółki oraz procedurą rokowań w malborskim magistracie. MALBORK. Aneta Florczyk – siłaczka z Malborka – przeszła do następnego etapu turnieju „Gwiazdy tańczą na lodzie”. Kolejny odcinek show „Gwiazdy tańczą na lodzie” z udziałem malborskiej siłaczki Anety Florczyk okazał się dla niej nie mniej fartownym niż poprzedni. Aneta znalazła się w grupie szczęśliwców, którzy bawić będą widzów następnym razem. MALBORK. - Trzeba się czasami pokłócić, bo życie byłoby nudne – mówi pani Jadwiga Studzińska. Poseł Cymański docenił... Jadwiga i Władysław Studzińscy obchodzili 50 rocznicę zawarcia związku małżeńskiego. Są szczęśliwymi rodzicami, mają pięciu synów i jedną córkę, a także są dziadkami dla czternaściorga wnucząt. Długiego stażu małżeńskiego gratulował poseł Tadeusz Cymański. Miłość i zrozumienie receptą na udane małżeństwo. – Chcę zmienić to miasto, mam takie ambicje i to zrobię – stanowczo podkreślił na koniec Andrzej Rychłowski. W jednym z najbliższych wydań naszej gazety postaramy się jak najprościej, krok po kroku opisać zmiany, które obejmą pl. Narutowicza i ul. Kościuszki. Informacja będzie służyć mieszkańcom całego miasta, by rozwiać domysły, spekulacje i plotki. Władze gminy zaplanowały na ten rok poważne inwestycje, ale wszystko zależy od tego, czy posiadane środki pozwolą na ich realizację. Potrzebna jest przede wszystkim nowa remiza dla OSP, sieć wodociągowa w jednej części miasta i we wsi Dębina oraz nowa płyta boiska piłkarskiego na miejskim stadionie. MALBORK. Z wielkiego bałaganu w samym centrum Malborka, spod kłębowiska rur i gruzu wyłania się powoli uporządkowany teren, który niebawem będzie pierwszym, prawdziwym rondem w mieście. Na skrzyżowaniu ulic Kościuszki, Mickiewicza i Piłsudskiego, a ściślej mówiąc pod skrzyżowaniem, po pierwsze, została wymieniona cała infrastruktura podziemna. Pierwotna kanalizacja sanitarna miała kanały piętrowe: górą płynęła deszczówka, dołem ścieki. Mieszała się zawartość kanałów, czego efektem był rozchodzący się, szczególnie latem, odór. Wydaje się, że od ubiegłego roku, szanse na to, byśmy na płycie wojskowego lotniska zobaczyli pasażerskie samoloty wzrosła. I tak, jak inni, na ten cel muszą wyłożyć grube miliony, malborski samorząd musiałby wydać mniej, bo około 20 mln złotych na budowę terminala. Bo teren, wojsko może nieodpłatnie przekazać w użytkowanie, jak ma nadzieję burmistrz. MALBORK. 28-letnią mieszkanka Nowego Stawu przebywała z czworgiem małoletnich dzieci na placu zabaw. Dziwnie się zachowywała. Miała ponad 4 promile we krwi!"
3755,3755,"Policjanci z malborskiej komendy zatrzymali 28-letnią mieszkankę Nowego Stawu. Kobieta była nietrzeźwa i przebywała z czworgiem małoletnich dzieci na placu zabaw. Teraz niefrasobliwa matka może odpowiedzieć za narażenie dzieci na niebezpieczeństwo. Na pewno sytuację rodziny rozpatrzy sąd. Benedykt XVI oraz Prezydium Episkopatu Polski złożyli kondolencje po katastrofie samolotu wojskowego. Ich życie zostało tragicznie przerwane na lotniczym szlaku napisał Ojciec Święty Benedykt XVI składając kondolencje po katastrofie, w której zginęło 20 oficerów lotników Wojska Polskiego. Najprawdopodobniej do wojewody pomorskiego trafił protest mieszkańców Pl. Narutowicza, który z kolei zwrócił się do Rady Miasta o uchylenie uchwały na dzierżawę bez przetargu i zakwestionował tryb podjęcia decyzji przez radę – tłumaczy Andrzej Rychłowski, burmistrz Malborka. - Szkoda, bo to opóźni nam budowę, ale by nie przedłużać procedur, rozpisaliśmy przetarg na dzierżawę tego terenu – wyjaśnia. 14 stycznia zapraszamy wszystkie dzieci na lodowisko. Będą konkursy, niespodzianki, zabawy na lodzie oraz rozgrzewająca gorąca zupa. Natomiast 25 stycznia, także na lodowisku, od 9 do 11 odbędzie się bal przebierańców. W programie występy bębniarzy i cheerleaderek, a także gorący posiłek. Dla wszystkich przebierańców odbędzie się konkurs na najciekawszy i najzabawniejszy strój. Dodajmy, że kilka dni później znak zakazu zatrzymywania został przestawiony, a w miejscu, gdzie nieprawidłowo zaparkował nasz Czytelnik, dziś jest miejsce parkingowe dla osoby niepełnosprawnej. Niepełnosprawny mieszkaniec miasta ma świadomość, że złamał przepisy i zapłaci grzywnę, którą wymierzył Sąd Grodzki. Nie godzi się jednak z nierównym traktowaniem. W jednej z miejscowości gminy Sztum, policjanci znaleźli dziuplę samochodową, w której znajdował się skradziony opel vectra z usuniętymi już znakami identyfikacyjnymi. Ponadto, stróże prawa zabezpieczyli dużą ilość części samochodowych i przedmioty mogące pochodzić ze skradzionych aut. Dziupla znajdowała się na terenie gospodarstwa rolnego 30-letniego Zbigniewa B. Chodzi o kwotę rzędu 100 - 200 tys. zł. Nie robiliśmy jeszcze kalkulacji szczegółowej. Ostateczny koszt będzie możliwy do określenia po sprecyzowaniu technologii, w jakiej ma być wykonana figura. Czy to jedyne źródło finansowania - dary na rzecz fundacji?"
3761,3761,"Jeżeli z funduszy unijnych uda nam się w najbliższych latach zbudować w powiecie starogardzkim choćby jedną drogę to powinniśmy się z tego cieszyć. Tak wygląda przewidywana, realna pomoc Unii w rozwoju naszego powiatu według budżetu na lata 2007-2013. W kraju mamy budżetowanie na każdy rok osobno. W Unii Europejskiej budżet opracowuje się raz na 7 lat. Aktualnie realizujemy budżet unijny na lata 2007-2013. Dlatego, jeszcze w tym miesiącu, wybiera się do Warszawy na spotkanie z wiceministrami transportu i obrony narodowej, aby pomówić i podjąć konkretne kroki zmierzające do wprowadzenie ruchu samolotów pasażerskich pod Malborkiem. Przypomnijmy, pod względem technicznym lotnisko w Królewie jest już praktycznie gotowe. Poniesione zostały nakłady na infrastrukturę (systemy naprowadzania, lądowania w trudnych warunkach itp.). Brakuje jedynie małego terminala pasażerskiego oraz określenia procedur współpracy z wojskiem. Niestety, na porządki trzeba będzie poczekać do wiosny, bo choć pogoda już jest wiosenna, to nigdy nie wiadomo, czy lada dzień nie spadnie śnieg i piaskarki znów będą musiały wjechać na ulice miasta. Burmistrz zapewnił, że w marcu możemy spodziewać się pierwszych porządków. Po rozmowach z przedstawicielami koła Światowego Związku Żołnierzy Armii Krajowej w Malborku, ustalono, że pomnik będzie przeniesiony w sąsiedztwo Zakładu Karnego, na zielony skwerek przy ul. Poczty Gdańskiej. Przenosiny obelisku związane są z zapowiadaną inwestycją przy ul. Piastowskiej – budowa obiektu gastronomicznego. Skoro ośrodek posiada pozwolenie i sprzedaż alkoholu odbywała się legalnie, to dlaczego w sobotę, w ofercie punktu nie było grzanego wina?"
3762,3762,"– W związku z tym, że handluje tam osoba prywatna, musi indywidualnie wystąpić o pozwolenie, żeby nie było wątpliwości natury prawnej. Osoba prowadząca działalność na terenie OSiR otrzymała już taką zgodę, ale decyzja musi się uprawomocnić – tłumaczy burmistrz Malborka. W ofercie zajęcia plastyczne, zajęcia taneczne, karaoke, występ „Zaczarowanego Teatru Lalek”, bal przebierańców, zabawy sportowe i wiele innych atrakcji. Wszystkie dzieci podczas zajęć mają zapewnione drugie śniadanie. Wszystkie chętne dzieci, które nie zdążą zapisać się na całotygodniowe zajęcia zapraszamy na przedstawienie ,,Zaczarowanego Teatru Lalek'' z Torunia pt. „Uwaga!"
3763,3763,"” 14 stycznia.2008 o godz. 14. Poprosiliśmy burmistrza o wyjaśnienia w tej sprawie. – Z posiadanej przeze mnie wiedzy i informacji przekazanej przez dyrektora OSiR, osoba dzierżawiąca teren pod handel na terenie ośrodka, w zamiarach miała sprzedaż gorącej czekolady oraz grzanego wina dla osób dorosłych – tłumaczy Andrzej Rychłowski, burmistrz Malborka. - Myślę, że jest to zupełnie normalne. Zresztą, OSiR posiada stosowne pozwolenie umożliwiające tego typu sprzedaż na jego terenie. Policjanci obezwładnili go i przewieźli na komendę, gdzie podczas badania alkomatem, kopnął jednego z funkcjonariuszy. Okazało się, że 22-latek jest żołnierzem służby czynnej. Został przekazany Żandarmerii Wojskowej w Malborku. Po emisji tej krótkiej notatki w naszej gazecie zgłosił się ojciec chłopaka, który przyniósł zgoła inną wersję wydarzeń. Dostarczył nam również kopię zawiadomienia o przestępstwie, którego mieli dopuścić się funkcjonariusze policji. Oprócz rekordu, Mistrzyni zaprezentowała swoją siłę także na inne sposoby – unosząc samochód oraz podnosząc nad głowę ponad 80-kilogramowego mężczyznę. Zwijanie patelni powiększyło liczbę rekordów Anety Florczyk, która ma cała kolekcja wyników w konkurencjach sportowych. Należałoby teraz oczekiwać jakichś spektakularnych rekordów – np. w łyżwiarstwie figurowym. Zwłaszcza, że taka operacja wprowadzenia lotów pasażerskich powiodła się ponoć na lotnisku wojskowym w Mińsku Mazowieckim. To otwiera i dla nas możliwości – twierdzi Andrzej Rychłowski, burmistrz Malborka. - Dowództwo bazy lotniczej patrzy przychylniej na pomysł budowy terminalu pasażerskiego na terenie należącym do wojska, chcemy więc nasze działania zintensyfikować – dodaje włodarz."
