,Unnamed: 0,sentence
2592,2592,"Praca może być związana z pieniędzmi innych ludzi np. w bankowości. Jeżeli władcą jest Pluton, znak Skorpiona na szczycie 6. lub 8. domu, prawdopodobne jest zaangażowanie się w prace badawcze lub w pracę związaną z seksem (seksuolog, ginekolog). Złe aspekty sprzyjają stratom finansowym w operacjach pieniężnych, chorobom spowodowanym seksem, a także negatywnej pracy w tej dziedzinie np. produkcja filmów porno. Jesteś wrażliwy, a twoje intuicyjne zdolności powinny być właściwie ukierunkowane. Niezbyt praktyczny gdy chodzi o finanse, często jesteś zależny w tym względzie od partnera. Seks niekoniecznie jest najważniejszy w twoim życiu, choć w niektórych przypadkach może być motywem do działania. Jako planeta pokoleniowa, przy swym położeniu w znaku wskazuje na głębokie przemiany społeczne zgodne ze znaczeniem tego znaku. Położenie w domu horoskopowym określa te dziedziny życia, gdzie osoba dąży do mobilizacji swych sił twórczych, samoodnowy oraz mówi o wpływie zmian cywilizacyjnych na osobę. Księżyc ma w horoskopie znaczący wpływ ze względu na swe najbliższe położenie względem Ziemi i najszybszy przebieg cyklu. Wprowadza do horoskopu pierwiastek żeński. Reprezentuje podstawy różnych początkowych działań człowieka i ich efekty. Mówi o pierwotnych instynktach i wrażliwości, które objawiają się w odpowiednich formach zachowania. Jest tu potrzeba pełnej ekspresji twej emocjonalnej postawy i twórczych możliwości, jeżeli władcą jest Wenus, Księżyc lub Słońce. Przy władającym Uranie twoja twórczość może ujawniać się jako zdolności wynalazcze. Zamiłowanie do sportu i talenty niesie znak Barana na szczycie 5. domu i Mars w 1. domu. Ponadto osoba jest zwykle silnie przywiązana do swych dzieci i ma z nimi dobry kontakt. Pluton źle aspektowany daje niecierpliwość lub zatracenie celowości swego postępowania, wrogie działanie przeciwko najbliższym, rodzinie, rodowi, ojczyźnie (najemni, tajni agenci na rzecz obcego wywiadu). PLUTON W LWIE - Przebywał w latach 1938-1957. Był to okres drugiej wojny światowej, wybuchu pierwszej bomby atomowej (Pluton rządzi siłą atomową), dyktatury w wielu krajach, rozwój telewizji. Jeżeli w horoskopie mamy większość planet w hemisferze dolnej, osoba jest introwertykiem. Jest mniej obiektywna, bardziej zamknięta w sobie, nie lubi popularności, może stronić od ludzi, często zadowala się pracą w ""cieniu"". Cechy te szczególnie się uwydatniają, gdy wśród tych planet znajdzie się Słońce i Księżyc. Jesteś szczery, liberalny, szlachetny i ambitny, pełen inwencji, wybitnie zdolny. Lubisz sport (lekkoatletykę, ćwiczenia siłowe), a także możesz mieć pewne skłonności do wojskowości, marynarki, odpowiada ci spartańskie wojskowe życie. Twoja aktywność, inwencja, bystrość, wesołe usposobienie i zdolność konwersacji przyciągają przyjaciół. Pieniądze możesz zdobyć za sprawą dziedziczenia, małżeństwa, przyjaciół. Niekiedy jednak możesz zawrzeć więcej niż jedno małżeństwo. Jesteś ambitny, zdecydowany, umiesz hamować swój temperament i masz silne duchowe skłonności. Jesteś kombinacją odwagi i ostrożności. Jesteś szlachetny, masz prawe dążenia, lecz możesz być ofiarą zbytniej służalczości. Możesz również być ofiarą ograniczeń religijnych, zbytniej dyscypliny lub dzieci. Staraj się odprężać i odsłaniać prawdziwe odczucia, a będziesz mile zaskoczony odzewem. Żywioły obejmują cztery grupy znaków. Każdy z nich zawiera trzy znaki oddalone wzajemnie od siebie o 120°, czyli pozostające w stosunku do siebie w tzw. trygonie. Żywioły różnią się przede wszystkim temperamentem. ŻYWIOŁ OGNIA - zawiera trzy znaki ogniste, tj. BARANA, LWA i STRZELCA. Charakteryzuje je żywiołowość, ruchliwość, szybki sposób działania, entuzjazm, cechy przywódcze oraz romantyzm. Jesteś poważny, czujny, gotowy do walki, pełen niedowierzania innym, wątpliwości, lęku, smutku, łatwo wpadasz w depresję. Potrafisz także być kłótliwym. Saturn w Pannie to niezbyt szczęśliwa kombinacja na dobre małżeństwo, chyba że zdobędziesz się na wysiłek i zaczniesz bardziej optymistycznie patrzeć na świat, gdyż inaczej sam będziesz winien trosk i nieszczęść w partnerstwie. Jesteś wewnętrznie zdolny do prawdziwej, platonicznej przyjaźni z osobami obojga płci bez romantycznego zaangażowania się. Cieszą cię kulturalne dążenia, wytworne zabawy i filozoficzne poglądy stymulujące intelektualnie. Jesteś szczery, prostolinijny, ale prawdopodobnie swoje własne opinie będziesz zatrzymywać dla siebie. Łatwo zyskujesz przyjaciół, niejednokrotnie w niezwykły sposób, masz ich wielu, choć zwykle szukasz ich wśród stojących wysoko na szczeblach społecznej drabiny. Masz chłonny umysł, zdolności organizacyjne, jesteś dalekowzroczny, posiadasz zdolność przewidywania i nie musisz obawiać się o wyniki swego działania. Będziesz mieć prawdopodobnie zyski dzięki swej pracy i zawodowi. Nie poddając się ograniczeniom, eksponujesz w niezależny i wolny sposób sprawy, które cię cieszą. Masz również pewne skłonności do potajemnego przeprowadzania swoich planów czy idei, aby je następnie wyciągnąć na światło dzienne. PLUTON W BLIŹNIĘTACH - Przebywał ostatnio w latach 1883-1913. Jest to era odkrycia elektryczności, początków lotnictwa, transportu samochodowego. Pierwsze zainteresowanie psychoanalizą i wprowadzanie testów na inteligencję, pierwszych kolei podziemnych, filmów, kamer i wiecznych piór. Może wystąpić pęd do nauki, poznawania nowych technik, zdolności krasomówcze, manualne, zdolność przekonywania, umiejętność wnikania w tajniki na drodze zmysłowej. Przy złych aspektach sarkazm, drwina, podstęp, krytyka, okłamywanie, złodziejstwo, czarna magia. Neptun - aspekt ten poszerza pole działania i wskazuje na niezwykłe wydarzenia, lecz może także dać tendencje do zbytniego idealizowania. Lubisz sztukę, muzykę, śpiew i taniec. Jest to dobry aspekt dla zawodów związanych z marynarką, ropą naftową, płynami, filmem, teatrem. Pluton - pomimo głębokich reakcji umiesz kontrolować swoje emocje. Cieszą cię osobiste kontakty z innymi, ale jednocześnie nie potrafisz zbyt długo wytrwać w jednym związku. Masz zdolność emocjonalnej regeneracji. Możesz zmieniać pracę lub mieć dwa zawody. Ogólnie masz dobry i szlachetny charakter i wysoko rozwinięty umysł. Możesz szybko poddawać się fali gniewu, ale zwykle nie żywisz długo urazy. Masz zdolność przewidywania wielu spraw i naturalne predyspozycje ""nauczyciela"". Nie lubisz przebywać zbyt długo w jednym miejscu i możesz często zmieniać adres zamieszkania. Jesteś skory do małżeństwa, w swoim życiu możesz zawrzeć więcej niż jeden związek. Jeżeli twoja Wenus jest dobrze aspektowana, masz wielki sentyment dla rodzeństwa, sąsiadów i współpracowników. WENUS W RAKU - Masz silne pragnienie osłaniać swoich najbliższych, ale i sam potrzebujesz poczucia bezpieczeństwa. Niestety, nie zawsze to będzie możliwe. Powinieneś zachować ostrożność w stykaniu się z różnymi płynami, gazem, a szczególne niebezpieczeństwo może przynieść ci woda (poparzenia, utonięcie). Masz skłonność marnować czas na bezowocne marzenia i działać tylko intuicyjnie, aby je zrealizować. Nie lubisz koncentrować się na jednym tylko zagadnieniu w danym czasie, a to na długo wstrzymuje możliwość dokonania tego, co zamierzałeś lub do czego jesteś zdolny. Jesteś rzeczowy, oszczędny, dobry organizator, masz dobrą głowę do interesów, szczególnie poważnych manipulacji finansowych. Masz tendencje do ciągłego udowadniania czegoś sobie i innym. Częste są tu kłopoty finansowe, ale uczysz się na własnych błędach i przeciwnościach losu umiejąc wysnuć poprawne wnioski. Przy silnym Plutonie masz zbyt wygórowane mniemanie o sobie. W horoskopie jest personifikacją osób starszych, doświadczonych - ojca, naukowców, zakonników, jak również ludzi związanych z rolnictwem. Symbolizuje czas, starość, śmierć, ruinę, samotność, fatalizm życiowy, przeszkody i nieszczęścia. Pozycja Saturna w horoskopie wskazuje tę dziedzinę życia, w której osoba odczuwa największy brak poczucia bezpieczeństwa i dąży do jego zrekompensowania. Merkury i Wenus - są w stosunku do siebie najdalej w odległości 74° zatem nie tworzą kwinkunksa. Mars - zwykle jesteś dobrze poinformowany lecz nie zawsze wykorzystujesz te informacje w nawale zajęć. Mimo że ciężko pracujesz nie zawsze twe wysiłki są doceniane. Jesteś niecierpliwy, bardzo impulsywny, a niekiedy irytujący. Jeżeli nie wyciszysz się, prawdopodobne są kłopoty ze zdrowiem. Zwykle są to ludzie o dużej tolerancji dla poglądów innych, bywają doskonałymi nauczycielami, krzewicielami nowych poglądów, badaczami, podróżnikami, odkrywcami nowych terenów i światów (np. paleontolodzy, astronomowie, astronauci itp.). Niekorzystne aspekty kreują przede wszystkim osoby ograniczone i fanatyków, negatywnych mistyków, bigotów, osoby ""nawiedzone"". To położenie Raka daje niezwykłe możliwości intuicyjne i przeczuwanie nadchodzących zdarzeń, co może pociągnąć za sobą stany depresyjne czy chorobę. Przy ascendencie w Skorpionie lub Koziorożcu, nieoczekiwane wydarzenia mogą skomplikować życie. Powinno się stale kontrolować swoje emocje gdyż folgowanie im jest niebezpieczne. MERKURY W KOZIOROŻCU - Jesteś ostrożny, rozsądny, pracowity i lubisz wszystko, co rozwija twój umysł. Możesz być niezwykle ruchliwy, co nie będzie kolidować z wykonywaniem obowiązków. Możesz być dobry zarówno w filozofii, jak i biznesie, nauce czy chemii. Często jesteś niezadowolony lub niespokojny z powodu sposobu, w jaki załatwiasz niektóre sprawy, wydajesz się być podejrzliwy co do motywów działania innych. Jest to klasyczny aspekt pisarzy lub nauczycieli, ponieważ jest tu wspólna oś domów: 9-tego = ideałów i 3-go = komunikacji. Powiązanie domów wskazuje również na zdobywanie wiedzy poprzez podróże. Aspekt ten występuje często u misjonarzy, którzy mają potrzebę komunikowania swej wiary innym i to w odległych miejscach. Niekorzystne aspekty ograniczają możność realizowania się w powyższych dziedzinach często z braku wykształcenia, zbyt zawężonych poglądów lub trudności w komunikowaniu się z innymi. Z Baranem na ascendencie możesz mieć kompleks niższości, w tym przypadku nie kontrolowane, ustawiczne sprawdzanie siebie może nieść ryzyko wypadku. Byk lub Ryby na ascendencie sprzyjają sprawdzaniu siebie w seksie. Miłość dla ciebie niekiedy sprzyja ocieraniu się o śmierć. Zainteresowanie zagadnieniami śmierci u niektórych osób może być silne, a nawet niebezpieczne, szczególnie gdy Mars lub Pluton odbierają złe aspekty. Nie stronisz od pewnych fizycznych, zmysłowych przyjemności, na przykład palenia papierosów. NEPTUN W BYKU - Masz wielką skłonność do luksusu, łatwizny i mistycyzmu. Możesz mieć dobre serce, być cierpliwy, nieskomplikowany w działaniu i zmysłowy. Jesteś przyjacielski i niebywale entuzjastyczny, angażujesz się w sprawy, w które wierzysz. Ta pozycja Neptuna może czynić cię wybuchowym w przypadku, gdy inni nie zgadzają się z twoimi nieugiętymi przekonaniami."
2614,2614,"Kilka dni temu w Zurychu 1300 osób, w tym poznańska zawodniczka Elżbieta Krakowiak, wzięło udział w zawodach IRON MAN. Były to kwalifikacje do Mistrzostw Świata, które odbędą się w pięknych plenerach hawajskiej wyspy. Niesamowity wysiłek, z jakim musiała zmierzyć się nasza zawodniczka 180 kilometrów na rowerze, 42 kilometry biegu i 3 kilometry wpław został wynagrodzony piątą pozycją na mecie."
2629,2629,"3. Intensywne światło padające na wasze źrenice, albo stopniowy nacisk wywierany odpowiednim aparatem pneumatycznym, sprawią, że będziecie mieli sny w kolorach."" Nawiasem mówiąc, ciekawe, na ile Dali sam stosował powyższe zasady i jakiej treści były kolorowe poniekąd sny wywołane zgodnie z zaleceniami z punktu trzeciego. Pewnej nocy śniłam, że wzięła mnie w swoje władanie pewna zła kobieta. Kiedy zorientowałam się, że jestem przez nią wykorzystywana, uciekłam z posesji. Szłam teraz polną drogą, gdy nagle wyprzedził mnie rosły i dziarski staruszek. Następnie zrównał się ze mną i tak szliśmy w milczeniu. Czułam się przy nim fantastycznie: błogo, bezpiecznie, spokojnie. W pewnym momencie zaciekawiona jego osobą przerwałam milczenie: PERYFERIE - miasta - znajdujesz się na granicy jakiegoś świata, jakiegoś celu; poczucie samotności i odgrodzenia od spraw międzyludzkich (od określonej grupy ludzi); moment przełomowy. PĘPEK - centrum życia; powiązanie wnętrza psychiki osoby śniącej ze światem zewnętrznym; jesteś ""pępkiem świata"" (w centrum zainteresowania); znak po ludzkiej tożsamości (od rodziców). BLIZNA - symbolizuje pamięć jakiejś krzywdy; uraz psychiczny; dawne wydarzenia, które nadal sprawiają ból; żal; poczucie krzywdy. Na szczęście żaden sen nie przepowiada całego życia, więc potem można czynić próby naprawienia tego, co się zniszczyło. KOPAĆ - zob.: łopata; praca nad odbudowywaniem podstaw. MACZUGA - pradawne narzędzie walki; uważaj, aby coś na ciebie nie spadło, abyś się nie uderzył itp. MADONNA - duchowy wyraz zasady żeńskiej; psyche; podatność na idee religijne; może ostrzegać przed niebezpieczeństwem lub cierpieniem, ale równocześnie przypomina nam o bożej ochronie. SALA - miejsce, gdzie nawiązujemy znajomości i relacje z innymi ludźmi; porównywanie siebie z innymi (pełna ludzi); sen prawdopodobnie będzie dotyczył spraw osobistych (związku z jedną osobą), bądź postrzegania siebie w odniesieniu do pewnej specyficznej grupy ludzi; obszar działań w określonej dziedzinie; KONKURENCJA - razem z innymi dążysz do jakiegoś celu; w swoich postępach możesz czuć się od nich lepszy lub gorszy. KONTAKT - gniazdko elektryczne - emocjonalna sfera w związku; kontakt z kimś oparty na wielkim potencjale emocjonalnym. KONTROLER - wewnętrzny kontroler twojego postępowania; aspekt prawno-moralny; lęk przed kontrolą; zob.: konduktor. JEMIOŁA - w pracy potrzeba ci więcej cierpliwości, w sprawach uczuciowych wszystko powinno się dobrze ułożyć. JESIEŃ - poczucie, że coś w życiu dobiega kresu; dojrzałe uczucie; ""jesień czyjegoś życia""; dojrzałość psychiczna i duchowa do zmian; koniec twórczych możliwości. JESION - symbol solidności i stabilizacji. NAŁÓG - coś, czemu ulegamy; jeden nałóg ze snu obrazuje jakąś konkretną słabość charakteru (tą samą lub inną); opamiętaj się w porę; pewna dziedzina życia, z którą sobie nie radzisz; wpadniesz w jakąś obsesję; lęk przed uzależnieniem od czegoś. NAMASZCZENIE - uświęcenie; przygotowanie do wykonania pewnego bohaterskiego czynu; poczucie, że jest się gotowym do wypełnienia jakiejś misji, zadania itp.; przygotowanie do śmierci; oczyszczenie. POWÓDŹ - zaleją cię destrukcyjne emocje lub źle transformowana energia; nie kontrolowane emocje i popędy z wielką siłą wyłonią się z podświadomości na światło dzienne; w szczególnych przypadkach mogą to być uczucia pozytywne. POWÓZ - zob.: jazda, pojazd oraz przykład pod hasłem koń. ZNAJOMOŚĆ - zawrzeć z kimś - poznasz ciekawą osobę. ZNAK - drogowy - na swojej drodze życia postępuj zgodnie z pewnymi zasadami; wskazówka; weź pod uwagę czy jest to znak nakazujący, zakazujący, informacyjny, czy ostrzegawczy. ZNALEŹĆ - coś - dokonasz odkrycia; uzyskasz dostęp do czegoś; odkryjesz coś lub uświadomisz sobie pewne kwestie; można znaleźć bezpieczne miejsce dla siebie, odkryć swoją lub czyjąś wartość, zdolności, predyspozycje itp. PRZYGODY - kłopoty; aktywny tryb życia; czasem: pragnienie, by życie było bardziej atrakcyjne, pełne niespodzianek. PRZYJACIEL - Opiekun Duchowy (Wyższe Ja) lub przewodnik; niższe ""ja""; te obie ""istności"" są dla nas niczym przyjaciele; pierwsza roztacza nad nami ochronę, sugeruje najlepsze rozwiązania, pomagając w ich realizacji; druga - przekazuje nasze prośby pierwszej, przywraca organizm do równowagi; gromadzi informacje (to tylko kilka z wielu funkcji); TORPEDA - destrukcyjna siła; czyjaś agresja. TORTURY - tortury fizyczne przeżywane we śnie oznaczają cierpienia psychiczne, szarpaninę oraz wewnętrzny niepokój; zdradzają również skłonności sadystyczne lub masochistyczne, zależnie od roli śniącego. TRAMWAJ, metro - zob.: autobus. TRATWA - płynąć nią - niepewność sytuacji; brak poczucia bezpieczeństwa; zob.: pływać. JODŁA - powiedzie ci się w życiu; szczęście. JODŁOWANIE - wszystko będzie się dobrze układać, szczególnie w sprawach sercowych. JOGIN - rezygnacja z aktywnego życia; chęć podjęcia się pracy nad sobą; podświadoma wiara w siłę ducha i umysłu; sen może ujawniać owe możliwości. - Potrzebuję pracy - wyjaśniam mu - nawet tej najgorszej. To chyba zrozumiał, bo prowadzi mnie pod długi, lecz niski budynek. Wchodzę do środka i natykam się na dozorcę. - Chciałbym pracować - proszę go. Patrzy na mnie niechętnie. - Nie będę sprawiał kłopotów - zapewniam, więc zgadza się. CIERŃ - symbolizuje cierpienia i trudności, głównie na tle uczuciowym. CIERPIENIE - fizyczne - przykrości i udręki moralne - cierpienie wyrażające się w odczuwaniu poczucia krzywdy, żalu, zranienia; - ból w okolicy serca - negatywne emocje będziesz odczuwał w sercu; może to być żal do kogoś, troska itp.; spróbuj zdystansować się do tego, co cię spotka; przejmowanie się raczej nie pomoże. Sen zobrazował kryzysową sytuację życiową śniącej i jej męża. Samoloty wroga symbolizują te niszczące siły losu, których można uniknąć lub nie. Gdybyśmy wobec tych przeciwności zareagowali negatywnym myśleniem lub działaniem, pomnożymy tylko złe siły, a te zrealizują się w naszym życiu. Sen niesie ze sobą przesłanie, że kryzysowe sytuacje powinniśmy przeczekać, jednocześnie otwierając się na pozytywne zmiany. REANIMACJA - starania mające na celu ocalenie tego, co ginie; np. miłości. RECEPTA - sposób na coś; zob.: rada. RECYTOWAĆ - będziesz odpowiadał, np. w szkole. REFLEKTOR - skupiona uwaga; koncentracja; zobaczenie w ""jasnym świetle"" pewnych treści. REKLAMA - twoja w środkach masowego przekazu - inni będą mogli poznać twoją twórczość. KRASNOLUDEK - niewielki, lecz interesujący (niezwykły) aspekt osobowości. KRAWAT - wiązać go - niepokoje i lęki związane z mającym nastąpić ważnym wydarzeniem, np. przyjęciem do pracy, ślubem, randką; starania, aby dobrze wypaść; przyjmowanie zbyt sztywnej postawy; ""branie się w ryzy""; napięcie i zduszenie związane z ""przywiązaniem"" sobie czegoś na poziomie czakry gardła; Pukałem zawzięcie. W końcu usłyszałem za drzwiami kobiecy głos: - Kto tam?"
2631,2631,"- rzuciłem. W końcu drzwi otwarły się i ukazała się w nich żona policjanta z ręcznikiem na głowie. Widocznie przed chwilą myła głowę. - Ja do pani męża - wyjaśniłem. - To bardzo ważne. HAMOWAĆ - będziesz musiał ""przystopować"" w pewnych działaniach; ""pohamujesz"" swoje emocje, powstrzymasz się od dalszych działań; powściągliwość w ryzykownym przedsięwzięciu; zwolnienie tempa pracy. HAMULEC - konieczność zwolnienia tempa; przeszkody na drodze do realizacji zamierzeń. HANDLARZ - ktoś może próbować wywrzeć na nas wpływ; nowy romans. CZAJNIK - uczucia pewnej kobiety lub śniącej - letnie lub gorące (które mogą doprowadzić do kłótni); stan emocji. CZAPKA - opinie; wierzenia, postawy, np. tiara wyraża religijność wraz z chęcią przewodzenia; zamiary; uczucia i emocje osoby, która we śnie nosi określonej barwy i fasonu nakrycie głowy; Jednocześnie zachowuje w stosunku do niej pewien dystans (ubrany jest w garnitur), stara się być dyplomatyczny. Nie błaga, nie szantażuje, lecz czyni próbę racjonalnego wyjaśnienia problemu. Prawa strona głowy dotyczy twórczości i intuicji. Zatem naprawiając i wstawiając śniącej brakującą ""piątą klepkę"", przyjaciel czyni ją czułą na swoje potrzeby. Sprawia, że śniąca zacznie go rozumieć oraz inaczej postrzegać. NAGROBEK - utrata uczuć, wzajemnej zgody czy przyjaźni z kimś; zob.: śmierć. NAGRODA - poczucie, że zostało się docenionym; poczucie własnej wartości; niedocenione wysiłki (potrzeba otrzymania nagrody). NAJAZD, nalot - ""nalot"" negatywnych myśli, emocji itp., którym trudno będzie się przeciwstawić; ""napad"" niskich energii, co w efekcie może wywołać chorobę; natłok spraw do załatwienia lub problemów; jesteś przeciążony psychicznie; zob.: napad. RAJ - sen o raju stanowi zwykle bardzo dobrą prognozę na przyszłość; czasami mogą zostać w ten sposób ujawnione beztroskie chwile naszego życia; wewnętrzna harmonia; nasze wyobrażenie na temat ""tamtego świata"" lub wręcz doznania zaczerpnięte z wyższych poziomów świata astralnego. W innym śnie również rozlega się pukanie do drzwi. Sytuacja jest podobna. - To ja, mama - słychać czyjś głos. - Mała ostrożnie zagląda w wizjer. Na korytarzu stoi kobieta o wyglądzie jej matki. - To ja, mamusia - słychać znowu - zapomniałam kluczy, otwórz!"
