type;source_sentence
1;Zwyciężyła po raz pierwszy kobieta, 22-letnia Portugalka.
1;Wszyscy byli po imieniu, bo terapeutka tak kazała.
1;Główną bohaterką książki S. K. Vaughn jest Maryam „May” Knox, czarnoskóra astronautka, która osiągnęła znaczny sukces zawodowy.
1;Właścicielka 3 aptek we Wrocławiu, 72-letnia farmaceutka w ciągu zaledwie 5 lat sprzedała w swoich placówkach 200 tysięcy opakowań leków z pseudoefedryną.
1;Straciła zezwolenie i została oskarżona. 72-letnia farmaceutka sprzedawała więcej niż jej pracownicy.
1;Farmaceuta z definicji specjalizuje się w dwóch dziedzinach - jakości leku oraz skuteczności i bezpieczeństwa farmakoterapii.
1;Jak wygląda droga do zostania geodetą i jakie wymagania trzeba spełnić, aby uzyskać uprawnienia?
1;Geodeta zajmuje się m.in. wykonywaniem pomiarów terenowych, sporządzaniem map, planów sytuacyjnych oraz inwentaryzacyjnych.
1;Geodeta na budowie również jest niezbędny do zawiadomienia o zakończeniu budowy obiektu budowlanego.
1;Geodetka z AGH opowiadała w TVP o swojej pracy.
1;Wróżbita przepowiedział Tomkowi że będzie długo żył i w dalekim kraju znajdzie to czego inni szukają.
1;Nasz wróżbita przepowiedział, że czekają nas wielkie zmiany.
1;Ciągle chodzi Ci po głowie, że może go mieć ta wróżbitka.
1;Ta wróżbitka wie wszystko na Twój temat!
1;Podczas pierwszej wizyty ortodonta przeprowadza szczegółowy wywiad, dokonuje badania klinicznego i ocenia dokumentację medyczną.
1;Aby móc oferować zabiegi korekcyjne, ortodonta bada ruch zębów.
1;Jako ortodontka zajmuję się wadami zgryzu.
1;Fizjoterapeutka z doświadczeniem w pracy z dziećmi i dorosłymi od 2008 roku.
0;Fotografia lub odbitka znaku towarowego może być wykonana dowolną techniką umożliwiającą ich reprodukcję.
0;Starsza kobieta, niestety, uwierzyła w tę bajeczkę.
0;Kobieta całuje go w czoło.
1;Istnieją wszelkie przesłanki do przypuszczenia, że pierwszy astronauta - także Rosjanin - wyląduje na Księżycu w roku 1970.
1;Farmaceuta to jeden z najbardziej pożądanych zawodów na rynku pracy województwa śląskiego.
0;Sylwetka ćmy jest krępa, lecz niewielkich rozmiarów.
1;Nie chcę nic sugerować, ale jest tam jedna fajna, prawie bezbłędna poetka.
1;A prawdziwy poeta to młodo umrzeć powinen.
1;Kto by nie chciał mieć wszystkiego w tubce, jak kosmonautka?
1;Bo przez tych ludzi, których spotkałem, pracując jako psychoterapeuta, poznałem potem Michała Lorenca.
0;Gdy dwaj bracia, w wieku 22 i 24 lat poczuli się źle, wezwano pogotowie, ale zanim dojechała karetka, starszy mężczyzna zmarł.
0;Wilk odprowadzał go wzrokiem, aż ciemna sylwetka rozpłynęła się w mroku korytarza.
0;Podobnie jak biureta, pipeta taka podzielona jest na całej swej długości na dziesiętne części mililitra.
0;Ankieta przeprowadzona przez sieć telewizyjną Fox zapowiada, że książka Moniki Lewinsky o jej stosunkach seksualnych prawie zupełnie nie interesuje Amerykanów.
0;Prędzej czy później można było liczyć, że Anita przyjmie jego zaproszenie.
0;Ta kobieta jednego dnia straciła męża i dowiedziała się o śmiertelnej chorobie swej córki.
0;Ani rozpustnicy, ani cudzołożnicy, ani rozwiąźli, ani mężczyźni współżyjący z mężczyznami nie wejdą do królestwa Bożego.
0;Literatura pozytywistyczna stworzyła wzorzec człowieka, któremu szło o szybkie dorobienie się dzięki menedżerskiej pracy umysłowej, choć w razie potrzeby umiał zakasać rękawy na przykład przy budowie własnej fabryki.
1;Przede wszystkim chcę pomagać ludziom i nie jest dla mnie istotne, czy będę to robił jako bioterapeuta.
1;Niedawno także na Podhale trafiła kaseta z nagraniem pobytu prezydenta Aleksandra Kwaśniewskiego na uroczystościach w Charkowie.
0;A moja zaciekłość bierze się stąd, że mam reminiscencje z przykrym incydentem, który relacjonowałem prawie siedem lat temu.
0;Gracie Hart, kobieta zaniedbana i o zapatrywaniach feministycznych otrzymuje zadanie udaremnienia przygotowywanego zamachu na konkurs piękności Miss Ameryki.
0;Nie, ona to robi z miłości, żeby ratować związek, żeby utrzymać tego faceta przy sobie, chce go chociaż tak zaspokoić, skoro nie potrafi w tym, co najważniejsze dla mężczyzny.
0;"Oprócz wątka sakralnego, który towarzyszyć będzie autorowi przez całe życie, szczególnie bliskiego wielu tym, którzy, jak Paszkiewicz, w bardzo młodym wieku zetknęli się z tragedią obozów koncentracyjnych, upodleniem, rozpaczą, gwałtowną śmiercią lub jej przeciwieństwem - powolnym umieraniem z głodu i wycieńczenia, ujawnia się tu głęboko humanistyczny i humanitarny zarazem krzyk w obronie ""ginących w nicość i samotność"", próba uratowania ich od ostatecznego unicestwienia."
0;W Polsce roślina bardzo pospolita na całym obszarze, jest jedną z najbardziej pospolitych naszych traw.
0;Ulica Matejki jest zamknięta dla ruchu kołowego na odcinku od skrzyżowania z ul. Szczecińską do ul. Nadrzecznej.
0;Kiedy wieczorem po raz kolejny przegryzał całą historię, oprócz żalu i rozczarowania odkrył w sobie także uczucie ulgi.
0;Makuch makowy zawierający do 12% tłuszczu i do 36% białka stanowi cenną paszę.
0;Ojciec był zapalonym myśliwym i często wybierał się na polowania, zasilając w ten sposób naszą spiżarnię.
1;"Stan cywilny: wdowiec, jedno dziecko (farmaceuta w najstarszej aptece w Nowym Sączu, w rynku ""Pod Orłem"")."
0;Numer telefonu miał być za to w książce telefonicznej komórki, którą znaleziono w samochodzie Kościelniaka.
0;Z minibusu dwóch chłopaków w dżinsach i adidasach, z białymi opaskami na włosach wyprowadza grubą kobietę w łachmanach.
0;Obok leżał rower, którym jechała kobieta.
1;Jeszcze dalej, najdalej ze wszystkich romantyków naszych, poszedł poznański poeta, wołając: Z nami Bóg!
0;To spotkanie będzie okazją do dobrej zabawy gromady dzieci specjalnej troski.
0;Śliczne czapki, brązowe z czarnym aksamitem, na które każdy z nas spoglądał ze słuszną dumą.
0;Na tej wyspie Mielt jak byliśmy to maluchy nasze przerobione na kabriolety z nalepką ford jeździły jako dwuosobowe auta wycieczkowe
0;Ojciec nie chciał nawet o tym słyszeć.
1;Nie ma takiego leku ani terapii - mówi psychoterapeuta Lin Jing Hua.
0;Nitka naprawdę tańczyła z igiełką?
1;A w hipnozie terapeuta podaje te formułki i rozwija, podkreśla i uzasadnia.
1;My tylko możemy w cichości ducha podziwiać i przeżywać to, co wielki poeta nam zostawił.
1;Kiedyś była tu kaplica, teraz po wybudowaniu dużego kościoła, pomieszczenia służą i warsztatom i organizacji wystaw – mówi Irena Zagórska, terapeutka prowadząca zajęcia w ramach warsztatów Terapii Zajęciowej przy Parafii Najświętszego Serca Pana Jezusa na Łapiszewie.